,content,date,like,tags,name,overlap,place
164,"*현시점 그림의떡, 코로나끝나면 가야될곳 3탄*✅ #캐나다_메리어트폴스뷰호텔..미국과 캐나다 국경에 걸쳐있으며 세계 3대 폭포로 꼽히는 나이아가라 폭포를 숙소안에서 만끽할수 있는 ""메리어트폴스뷰호텔앤스파"" 다른 곳에서 보기 힘든 풍경을 보여주는만큼 이곳만의 매력을 듬뿍 담은 힐링 공간이다..호텔답게 다양한 종류의 객실을 갖추고 있지만 가장 인기가 많은 공간은 나이아가라 폭포를 볼수 있는 폴스뷰이다. 확트인 통창에서 시원한 물소리, 무지개 등 자연이 선물해주는 풍경을 감상할수 있다. 해가 져도 조명들이 폭포를 비춰주기 때문에 아름다운 야경까지 한눈에 즐길수 있는 공간..예약할때 이름이 비슷한 호텔이 바로 옆에 있어서 주의가 필요하며 높은 층으로 선택해야 아름다운 나이아가라 폭포를 한눈에 바라볼수 있으니 참고할것. 주변에 폭포 말고도 클리프턴힐 같은 놀이공원이나 쇼핑 센터도 있어서 여행하기에 좋다...✔ 더 많은 북아메리카숙소는 #감성숙소_북아메리카✔ 더 많은 캐나다숙소는 #감성숙소_캐나다...#캐나다 #온타리오 #나이아가라 #메리어트폴스뷰호텔- - - - - - - - - - - - - - - - - - - - - - - - - - - - - -📍메리어트폴스뷰호텔📍6740 Fallsview Boulevard , Niagara Falls, ON, Canada📍평일 240,000원대 (폭포뷰 슈페리어 고층, 비수기 기준)- - - - - - - - - - - - - - - - - - - - - - - - - - - - - -Contents by Insta. gamsung_curationVideo source.insta by @rachel.righthere.#해외여행 #신혼여행 #토론토여행 #북미여행 #캐나다여행 #캐나다리조트 #캐나다호텔 #신혼여행지추천 #나이아가라폭포 #메리어트폴스뷰앤스파 #감성숙소",2020-11-13,0,"['#캐나다_메리어트폴스뷰호텔..미국과', '#감성숙소_북아메리카✔', '#감성숙소_캐나다...', '#캐나다', '#온타리오', '#나이아가라', '#메리어트폴스뷰호텔-', '#해외여행', '#신혼여행', '#토론토여행', '#북미여행', '#캐나다여행', '#캐나다리조트', '#캐나다호텔', '#신혼여행지추천', '#나이아가라폭포', '#메리어트폴스뷰앤스파', '#감성숙소']",메리어트폴스뷰호텔,0,
165,"✅ #인천_호텔무무..인천 강화도 산속에서 자연과 함께 힐링하기 좋은 ""호텔무무"" 바다와 가까운 거리에 있기 때문에 바다와 산을 동시에 즐길수 있는 공간..최대 2인부터 5인까지 갈수 있는 다양한 객실이 준비되어있는데 전체적으로 빈티지한 인테리어와 자연이 잘 어우러지게 꾸며진 공간이다. 가장 큰 매력 포인트로 꼽히는 공간은 숲을 바라보며 즐기는 스파 공간인데 실외와 실내 등 종류도 다양해서 취향대로 골라가기에 좋다. 아이 또는 애완견과 함께 갈수 있는 공간까지 있어서 친구, 연인, 가족들과 갈수 있다..스튜디오와 웨딩 촬영으로도 많이 이용되는 만큼 주변 풍경이 아름다워서 인생 사진을 건질수도 있으며 카페와 함께 운영되는 공간에서는 웰컴티와 조식까지 즐길수 있다. 새소리, 바람소리, 풀벌레 소리와 함께 따스하게 비춰지는 햇살과 함께 기분좋은 여행을 선물 받는 공간..✔ 더 많은 강화도숙소는 #감성숙소_강화도✔ 더 많은 인천숙소는 #감성숙소_인천..#인천 #강화도 #호텔무무- - - - - - - - - - - - - - - - - - - - - - - - - - - - - -📍호텔무무📍인천 강화군 화도면 해안남로1066번길 12📍평일 270,000원 (H3프렌치화이트, 비수기 기준)- - - - - - - - - - - - - - - - - - - - - - - - - - - - - -Contents by Insta. gamsung_curationImage source.insta by @danmi_kkinsta by @j._hminsta by @cosmopolitan_ellyinsta by @my_j.raon__insta by @rahwaflower.#인천여행 #인천펜션 #인천독채펜션 #인천풀빌라 #강화도독채펜션 #강화도여행 #강화도펜션 #강화도풀빌라 #감성숙소 #독채펜션 #무무펜션 #강화도카페",2020-11-11,2758,"['#인천_호텔무무..인천', '#감성숙소_강화도✔', '#감성숙소_인천..', '#인천', '#강화도', '#호텔무무-', '#인천여행', '#인천펜션', '#인천독채펜션', '#인천풀빌라', '#강화도독채펜션', '#강화도여행', '#강화도펜션', '#강화도풀빌라', '#감성숙소', '#독채펜션', '#무무펜션', '#강화도카페']",호텔무무,0,인천광역시 강화군 화도면 사기리 100
166,"✅ #공주_클레리아..공주 계룡산이 보이는 조용하고 한가한 마을 안에 자리 잡은 ""클레리아"" 산으로 둘러쌓인 공간에서 다른 이들과 마주치지 않고 오롯이 우리만의 시간을 보내기에 좋은 공간. .1층에는 거실과 주방, 스파와 수영장이 있으며 2층에는 확트인 통창으로 자연을 만끽하기 좋은 침실로 구성되어 있다. 수영장은 외부 수영장과 내부 수영장으로 나뉘어져있어서 취향대로 계절에 맞게 골라갈수 있다. 주변 산책로와 넓은 마당까지 있어서 친구, 가족, 연인들과 함께 놀러가기 좋다..고요하고 평온한 숲속안에서 새소리, 풀벌레 소리를 배경삼아 힐링할수 있는 공간. 주변에 편의점이나 마트가 없으니 들어가기 전에 물품을 충분히 구비하는 것을 추천..✔ 더 많은 공주숙소는 #감성숙소_공주✔ 더 많은 충청남도숙소는 #감성숙소_충청남도..#충청남도 #공주 #클레리아- - - - - - - - - - - - - - - - - - - - - - - - - - - - - -📍클레리아📍충남 공주시 계룡면 시화산1길 27📍평일 230,000원 (VILLA102, 비수기 기준)- - - - - - - - - - - - - - - - - - - - - - - - - - - - - -Contents by Insta. gamsung_curationImage source.insta by @sssj_s2_insta by @park_solsolsolinsta by @da.yulye insta by @hyoli_m insta by @s2_0917.#공주여행 #공주펜션 #공주풀빌라 #공주독채펜션 #충남펜션 #충남여행 #충남독채펜션 #충남풀빌라 #감성숙소 #독채펜션 #풀빌라 #대전근교여행 #클레리아풀빌라",2020-11-09,2202,"['#공주_클레리아..공주', '#감성숙소_공주✔', '#감성숙소_충청남도..', '#충청남도', '#공주', '#클레리아-', '#공주여행', '#공주펜션', '#공주풀빌라', '#공주독채펜션', '#충남펜션', '#충남여행', '#충남독채펜션', '#충남풀빌라', '#감성숙소', '#독채펜션', '#풀빌라', '#대전근교여행', '#클레리아풀빌라']",클레리아,0,충청남도 공주시 계룡면 내흥리 503
167,"✅ #제주_스테이연가..제주 애월항과 멀지 않은 위치에 조용히 자리잡은 ""스테이연가"" 안거리, 밖거리, 자쿠지, 마당으로 구성되어있는 단독 주택을 오롯이 한 팀만이 이용할수 있는 공간..안거리에는 침실과 거실, 아이들이 놀기 좋은 놀이방과 반신욕을 하기 좋은 욕조가 있는 화장실이 있다. 밖거리에는 두개의 침대가 나란이 붙어있는 침실과 조용히 사색을 즐길수 있는 공간이 있으며 자쿠지는 어른들이 들어가도 충분히 큰 크기여서 가족이 함께 놀기에 좋다..화이트& 우드톤의 모던함을 조화롭게 섞어서 편하면서도 한가로운 여행을 즐길수 있다. 곳곳에 놓인 아기자기한 소품들에서 주인장의 감성과 배려를 고스란이 느낄수 있는 공간..✔ 더 많은 애월읍숙소는 #감성숙소_애월읍✔ 더 많은 제주숙소는 #감성숙소_제주..#제주 #애월읍 #스테이연가- - - - - - - - - - - - - - - - - - - - - - - - - - - - - -📍스테이연가📍제주 제주시 애월읍 애월남안길 9📍평일 350,000원 (3~6인, 비수기 기준)- - - - - - - - - - - - - - - - - - - - - - - - - - - - - -Contents by Insta. gamsung_curationImage source.insta by @luvjianinsta by @_luvlani .#제주여행 #제주펜션 #제주독채펜션 #제주풀빌라 #제주도풀빌라 #제주도독채펜션 #제주도여행 #제주도펜션 #키즈펜션 #감성숙소 #독채펜션 #애월숙소 #가족여행",2020-11-02,2111,"['#제주_스테이연가..제주', '#감성숙소_애월읍✔', '#감성숙소_제주..', '#제주', '#애월읍', '#스테이연가-', '#제주여행', '#제주펜션', '#제주독채펜션', '#제주풀빌라', '#제주도풀빌라', '#제주도독채펜션', '#제주도여행', '#제주도펜션', '#키즈펜션', '#감성숙소', '#독채펜션', '#애월숙소', '#가족여행']",스테이연가,0,제주특별자치도 제주시 애월읍 애월리 1497
168,"✅ #홍천_리버트리펜션..홍천강에서 빼어난 자연 암벽뷰를 한눈에 즐길수 있는 ""리버트리"" 다른이들에게 방해받지 않고 오롯이 우리들만의 공간에서 자연과 함께 힐링하기 좋은 공간..전객실에서 확트인 통창으로 산과 강을 바라보며 자연이 선물해주는 풍경을 즐기기 좋다. 화이트와 우드, 스톤이 적절하게 섞여있는 내부 인테리어는 모던함을 느낄수 있다. 물소리, 풀벌레소리가 들려오는 야외 개별 바베큐 장은 캠핑 감성까지 느끼게 해줘서 매력이 더해지는 공간. .1층 공용 수영장은 시간대 별로 개별 예약을 받아서 이용하기 때문에 단독으로 사용할수 있다. 또한 바로 앞 홍천강에서 체험을 즐길수도 있으며 밤이 되면 쏟아질듯한 별을 바라보며 불멍하는 것을 추천..✔ 더 많은 홍천숙소는 #감성숙소_홍천✔ 더 많은 강원도숙소는 #감성숙소_강원도..#강원도 #홍천 #리버트리펜션- - - - - - - - - - - - - - - - - - - - - - - - - - - - - -📍리버트리펜션📍강원 홍천군 북방면 장항2길 14-9📍평일 330,000원 (201호, 비수기 기준)- - - - - - - - - - - - - - - - - - - - - - - - - - - - - -Contents by Insta. gamsung_curationImage source.insta by @mj_luvs2insta by @_luvlaniinsta by @laun_kr insta by @seeul2 .#홍천여행 #홍천펜션 #홍천풀빌라 #홍천독채펜션 #강원도펜션 #강원도여행 #강원도독채펜션 #강원도풀빌라 #감성숙소 #독채펜션 #풀빌라 #리버트리",2020-10-28,2405,"['#홍천_리버트리펜션..홍천강에서', '#감성숙소_홍천✔', '#감성숙소_강원도..', '#강원도', '#홍천', '#리버트리펜션-', '#홍천여행', '#홍천펜션', '#홍천풀빌라', '#홍천독채펜션', '#강원도펜션', '#강원도여행', '#강원도독채펜션', '#강원도풀빌라', '#감성숙소', '#독채펜션', '#풀빌라', '#리버트리']",리버트리펜션,0,강원도 홍천군 북방면 장항리 201-2
169,"✅ #부산_nnnn부산..부산 서면 카페거리 근처에서 만날수 있는 일본식+한국식 건물 ""nnnn부산"" 이름도 없고 소음도 없다는 뜻을 가진만큼 독특하면서 주인장의 감성을 담은 공간..히노끼 나무향이 가득한 공간에 들어가면 타자기, LP스피커 등 아기자기한 소품으로 가득해서 하나하나 구경하는 재미까지 누릴수 있다. 1층에는 침실과 주방, 2층에는 작업실이나 스튜디오 공간으로 꾸며져있어서 포토존으로 사용할수도 있다. 올라가는 계단이 많이 가파른 편이라 주의가 필요하지만 그만큼 아늑한 공간을 누릴수 있다..일반적인 펜션이 아닌 독특하면서 아날로그 감성이 가득한 카페에 온듯한 느낌을 주는 공간. 숙소 주변에 카페나 맛집이 많이 있기 때문에 여행하기에도 좋다..✔ 더 많은 전포동숙소는 #감성숙소_전포동✔ 더 많은 부산숙소는 #감성숙소_부산..#부산 #전포동 #nnnn부산- - - - - - - - - - - - - - - - - - - - - - - - - - - - - -📍nnnn부산📍부산광역시 부산진구 동성로39번길 8-1📍평일 120,000원대 (비수기 기준)- - - - - - - - - - - - - - - - - - - - - - - - - - - - - -Contents by Insta. gamsung_curationImage source.insta by @su__miny_insta by @nnnn_busaninsta by @yu_dong_ insta by @2_centi .#부산여행 #부산펜션 #부산에어비앤비 #에어비앤비부산 #전포동숙소 #전포숙소 #에어비앤비 #감성숙소 #서면카페거리",2020-10-21,1650,"['#부산_nnnn부산..부산', '#감성숙소_전포동✔', '#감성숙소_부산..', '#부산', '#전포동', '#nnnn부산-', '#부산여행', '#부산펜션', '#부산에어비앤비', '#에어비앤비부산', '#전포동숙소', '#전포숙소', '#에어비앤비', '#감성숙소', '#서면카페거리']",부산광역시,0,
170,"✅ #양주_일영댁..서울에서 멀리 떨어져있지 않은 경기도 양주 조용한 마을 안에 위치한 ""일영댁"" 넓은 잔디 마당을 가진 전원 주택에서 누리는 아늑한 에어비앤비 공간이다..1층과 루프탑을 손님들에게 내어주고 2,3층은 주인이 사용하는 공간이라 각층에서 우리만의 시간을 보낼수 있다. 아늑하면서 아기자기한 소품으로 가득한 공간에는 주인장의 감성이 고스란이 남겨져있다. 최근 오픈한 루프탑 공간에서는 북한산이 보이는 전망으로 야외 테라스에서 자연을 바라보며 힐링하기 좋다..북적거리는 서울에서 멀리 벗어나지 않아도 새소리, 개구리소리를 배경삼아 티비 없이 오롯이 서로에게 집중하기 좋다. 주변에 걸어서 갈수 있는 편의시설이 없기 때문에 들어가기전 필요한 것을 준비하고 가는 것을 추천..✔ 더 많은 양주숙소는 #감성숙소_양주✔ 더 많은 경기도숙소는 #감성숙소_경기도..#경기도 #양주 #일영댁- - - - - - - - - - - - - - - - - - - - - - - - - - - - - -📍일영댁📍경기 양주시 장흥면 일영리📍평일 120,000원대 (1층, 비수기 기준)- - - - - - - - - - - - - - - - - - - - - - - - - - - - - -Contents by Insta. gamsung_curationImage source.insta by @e_ehyeon_insta by @dann_meeinsta by @iamchungwooninsta by @lattenenmaria insta by @guryong_s insta by @zzmee__.#양주여행 #양주펜션 #양주독채펜션 #양주에어비앤비 #경기도펜션 #경기도여행 #경기도독채펜션 #감성숙소 #독채펜션 #에어비앤비",2020-10-14,2513,"['#양주_일영댁..서울에서', '#감성숙소_양주✔', '#감성숙소_경기도..', '#경기도', '#양주', '#일영댁-', '#양주여행', '#양주펜션', '#양주독채펜션', '#양주에어비앤비', '#경기도펜션', '#경기도여행', '#경기도독채펜션', '#감성숙소', '#독채펜션', '#에어비앤비']",일영댁,0,
171,"✅ #담양_선인장호스텔..담양 중심에서 살짝 벗어나 나무들로 둘러쌓여 자연을 즐길수 있는 ""선인장호스텔"" 글램핑과 펜션, 카페를 모두 한번에 즐길수 있어서 더욱 매력있는 공간..에어스트림은 2인부터 4인까지 들어갈수 있는 다양한 크기로 구성되어있으며 빈티지, 노르딕, 내추럴 등 다양한 테마로 꾸며져있다. 또한 입욕제를 구비해놓은 만큼 넓은 욕조까지 갖춰져있어서 더욱 편안하게 글램핑하기 좋다. 건물 1층에는 카페와 매점을 운영하고 있으며 그 위에는 2인부터 최대 6인까지 가능한 펜션으로 꾸며져있어서 펜션에 묵으면서 캠핑 느낌을 낼수도 있다..바람소리, 새소리와 함께 계절의 흐름에 따라 뒤바뀌는 숲속 풍경을 즐기기에 좋은 공간. 연인, 가족, 친구들과 함께 쏟아질듯한 별을 바라보며 하루를 마무리하고 일어나 산책로를 한번 걸어보는 것을 추천..✔ 더 많은 담양숙소는 #감성숙소_담양✔ 더 많은 전라남도숙소는 #감성숙소_전라남도..#전라남도 #담양 #선인장호스텔- - - - - - - - - - - - - - - - - - - - - - - - - - - - - -📍선인장호스텔📍전남 담양군 월산면 담장로 548📍평일 150,000원 (에어스트림 2인승, 비수기 기준)- - - - - - - - - - - - - - - - - - - - - - - - - - - - - -Contents by Insta. gamsung_curationImage source.insta by @su__ziinsta by @yj_florescenceinsta by @_riming_ insta by @gxdxx__insta by @gayeon_graminsta by @from_minjuinsta by @__jjiiwoooooo.#담양여행 #담양펜션 #담양카라반 #담양글램핑 #담양게스트하우스 #전남펜션 #전남여행 #전남글램핑 #감성숙소 #글램핑 #카라반",2020-10-12,2919,"['#담양_선인장호스텔..담양', '#감성숙소_담양✔', '#감성숙소_전라남도..', '#전라남도', '#담양', '#선인장호스텔-', '#담양여행', '#담양펜션', '#담양카라반', '#담양글램핑', '#담양게스트하우스', '#전남펜션', '#전남여행', '#전남글램핑', '#감성숙소', '#글램핑', '#카라반']",선인장호스텔,0,전라남도 담양군 월산면 중월리 442
172,"✅ #거제_라이트하우스..거제 가조도의 푸른 바다를 한눈에 담을수 있는 ""라이트하우스"" 편안하면서 포근한 휴식을 누릴수 있는 따스한 공간에서 여행을 즐기기 좋은 공간..바다를 향해 천장까지 나있는 통창으로 시간의 흐름에 따라 뒤바뀌는 바다와 하늘을 바라보기에 좋은 공간. 2개의 복층 객실과 1개의 단층 객실으로 구성된 객실은 모두 오션뷰이며 스파까지 갖춰져있어서 여행의 피로를 풀기에도 좋다. 보드게임이나 오락기, 야외 수영장까지 갖춰져있어서 가족, 친구, 연인들과 함께 추억을 만들수 있다..주인장의 감성이 물씬 담긴 공간에서 파도소리를 배경삼아 가만히 앉아있다보면 어느새 어둑해진 하늘에서 쏟아질듯한 별까지 구경할수 있다. 바로 앞에서 낚시를 즐길수도 있으며 주변 관광지와도 가깝게 위치해 있어서 관광하기에도 좋다..✔ 더 많은 거제숙소는 #감성숙소_거제✔ 더 많은 경상남도숙소는 #감성숙소_경상남도..#경상남도 #거제 #라이트하우스- - - - - - - - - - - - - - - - - - - - - - - - - - - - - -📍라이트하우스📍경남 거제시 사등면 가조로 1228📍평일 139,000원 (202호, 비수기 기준)- - - - - - - - - - - - - - - - - - - - - - - - - - - - - -Contents by Insta. gamsung_curationImage source.insta by @d251996insta by @wonjisuninsta by @lighthouse_geojeinsta by @bonoyabinsta by @em90_chainsta by @yeinnn_i.#거제여행 #거제펜션 #거제풀빌라 #경남여행 #경남펜션 #경남풀빌라 #감성숙소 #거제라이트하우스 #라이트하우스펜션 #거제도라이트하우스 #가조도펜션",2020-10-09,3176,"['#거제_라이트하우스..거제', '#감성숙소_거제✔', '#감성숙소_경상남도..', '#경상남도', '#거제', '#라이트하우스-', '#거제여행', '#거제펜션', '#거제풀빌라', '#경남여행', '#경남펜션', '#경남풀빌라', '#감성숙소', '#거제라이트하우스', '#라이트하우스펜션', '#거제도라이트하우스', '#가조도펜션']",라이트하우스,0,제주특별자치도 제주시 조천읍 북촌리 721-2
173,"✅ #가평_하늘숲글램핑..하늘과 숲이 어우러진 가평 숲속에서 만날수 있는 ""하늘숲글램핑"" 바로 옆, 작은 계곡까지 갖춰져있어서 자연속에서 우리만의 캠핑을 누리기 좋은 공간..텐트부터 에어스트림 등 다양하게 갖춰져있으며 2인 객실부터 최대 5인까지 들어갈수 있는 공간까지 있어서 친구, 연인, 가족들과 함께 가기 좋다. 또한 강아지도 함께 갈수 있는 객실까지 보유한 만큼 취향대로 골라가기 좋다..식기구부터 냉난방기까지 갖춰져있으며 내부에는 작은 화장실까지 있어서 더욱더 편하게 즐길수 있는 캠핑장이다. 가만히 앉아 자연이 주는 소리를 배경삼아 도란도란 이야기꽃을 피우기에 좋다..✔ 더 많은 가평숙소는 #감성숙소_가평✔ 더 많은 경기도숙소는 #감성숙소_경기도..#경기도 #가평 #하늘숲글램핑- - - - - - - - - - - - - - - - - - - - - - - - - - - - - -📍하늘숲글램핑📍경기 가평군 가평읍 호반로 2092📍평일 140,000원 (에어스트림A 기준)- - - - - - - - - - - - - - - - - - - - - - - - - - - - - -Contents by Insta. gamsung_curationImage source.insta by @datdat.kinsta by @ziziso_oinsta by @kim_berry_insta by @yeong_stginsta by @minikoh010.#가평여행 #가평펜션 #가평글램핑 #가평캠핑 #경기도여행 #경기도펜션 #경기도글램핑 #경기도캠핑 #국내숙소 #감성숙소",2020-10-05,1739,"['#가평_하늘숲글램핑..하늘과', '#감성숙소_가평✔', '#감성숙소_경기도..', '#경기도', '#가평', '#하늘숲글램핑-', '#가평여행', '#가평펜션', '#가평글램핑', '#가평캠핑', '#경기도여행', '#경기도펜션', '#경기도글램핑', '#경기도캠핑', '#국내숙소', '#감성숙소']",하늘숲글램핑,0,경기도 가평군 북면 소법리 152-4
174,"✅ #제주_차와무드별채..제주도 평대리 한적한 바닷마을 안 오롯이 둘만 위한 공간 ""차와무드 별채"" 초록의 고즈넉함과 바다의 시원함을 모두 품은 공간..50년이 넘는 돌담과 대나무로 둘러쌓인 공간을 들어가면 곳곳에 나있는 창으로 초록뷰를 만끽할 수 있는 공간. 전체적으로 우드톤으로 꾸며진 공간은 침실과 다도를 즐길수 있는 공간, 여행의 피로를 풀수 있는 반신욕조가 있는 욕실로 구성되어있다..마당 데크에서 차를 마시며 제주 바다를 바라볼수도 있고 주변 식당, 카페가 걸어서 갈수 있는 거리에 많이 있기 때문에 산책하기에도 좋다. 차와 커피를 위한 공간이라 주방기구가 없으며 취사가 불가능하니 참고할것. .✔ 더 많은 구좌읍숙소는 #감성숙소_구좌읍✔ 더 많은 제주숙소는 #감성숙소_제주..#제주 #구좌읍 #차와무드별채- - - - - - - - - - - - - - - - - - - - - - - - - - - - - -📍차와무드별채📍제주 제주시 구좌읍 평대리📍평일 200,000원 (비수기 기준)- - - - - - - - - - - - - - - - - - - - - - - - - - - - - -Contents by Insta. gamsung_curationImage source.insta by @_danie_einsta by @boriyaaaainsta by @shins_daily .#제주여행 #제주펜션 #제주독채펜션 #제주풀빌라 #제주도풀빌라 #제주도독채펜션 #제주도여행 #제주도펜션 #감성숙소 #차와무드 #에어비앤비",2020-10-02,2997,"['#제주_차와무드별채..제주도', '#감성숙소_구좌읍✔', '#감성숙소_제주..', '#제주', '#구좌읍', '#차와무드별채-', '#제주여행', '#제주펜션', '#제주독채펜션', '#제주풀빌라', '#제주도풀빌라', '#제주도독채펜션', '#제주도여행', '#제주도펜션', '#감성숙소', '#차와무드', '#에어비앤비']",차와무드별채,0,
175,"✅ #서울_에어비앤비숙소..시간의 흐름에 따라 뒤바뀌는 서울역과 도심을 넓은 통유리로 즐길수 있는 에어비앤비. 넓은 공간은 아니지만 둘만의 공간에서 소중한 추억을 만들기 좋은 공간. .조그맣게 들려오는 기차소리를 배경삼아 누구에게도 방해받지 않는 공간에서 도란도란 이야기 나누기에 좋다. 29층 피트니트센터, 스카이라운지, 루프탑 이용 등 내부 시설까지 이용할수 있어서 더욱 매력적인 공간..바쁘게 지나가는 일상에서 잠시 벗어나 도심의 석양과 야경을 즐기다보면 어느새 시간은 훌쩍 흘러가있을 것이다. 에어비앤비에서 용산을 검색하면 같은 건물에 여러개의 숙소가 나오니 내부 인테리어를 참고해 취향대로 골라가면 된다. .✔ 더 많은 용산숙소는 #감성숙소_용산✔ 더 많은 서울숙소는 #감성숙소_서울...#서울 #용산 #에어비앤비- - - - - - - - - - - - - - - - - - - - - - - - - - - - - -📍에어비앤비📍서울특별시 용산구📍개별 숙소 가격 참고- - - - - - - - - - - - - - - - - - - - - - - - - - - - - -Contents by Insta. gamsung_curationImage source.insta by @ioh__o8insta by @05yong_a20insta by @sheep12x_xinsta by @rosevella__ insta by @luv_0730_insta by @warrior._e insta by @01x54.#서울여행 #서울펜션 #에어비앤비서울 #서울독채펜션 #서울에어비앤비 #독채펜션 #서울숙소 #에어비앤비용산 #감성숙소",2020-09-30,4553,"['#서울_에어비앤비숙소..시간의', '#감성숙소_용산✔', '#감성숙소_서울...', '#서울', '#용산', '#에어비앤비-', '#서울여행', '#서울펜션', '#에어비앤비서울', '#서울독채펜션', '#서울에어비앤비', '#독채펜션', '#서울숙소', '#에어비앤비용산', '#감성숙소']",에어비앤비,0,경기도 양주시 백석읍 연곡리 211
