,content,date,like,tags,name,overlap,place
546,"#경주_숙조당경주에 위치하고있는 자연 속 한옥 독채민박 '숙조당'새가 머무는 곳이라는 뜻의 이 숙소는 외부와 완전히 분리된 곳으로 집 전체를 단독으로 사용하며 넓은 마당과 푸릇푸릇한 식물들, 대나무숲을 가지고있어 아름다운 자연 속에서 조용히 힐링할 수 있는 곳입니다. 야외 곳곳에 테이블이 준비되어있어 도란도란 모여 이야기하며 여유로운 시간을 보내기 좋습니다.폴딩도어와 넓은 통창으로 마당을 마주하고있는 거실 겸 주방, 하나의 방과 욕실이 있으며 전체 우드톤으로 매우 깔끔하고 따뜻하게 꾸며져 있습니다. 실내에도 곳곳에 꽃과 식물들이 놓여있어 기분좋게 합니다.감성가득한 프라이빗한 바베큐장과 처마아래 시원한 평상, 신선한 채소가 있는 텃밭까지 가지고 있어 아기들이 와도, 친구들끼리 와도 좋은 체험과 추억을 가득 담아 갈 수 있는 공간입니다.보기만해도 편안해지는 자연 속 프라이빗한 시골 별장같은 곳————————————————숙조당위치: 경북 경주시 다불로 177체크인: 15:00체크아웃: 11:00가격: 340000원 (평일기준)숙소문의: @sookjodang기타: —————————————————🏷감성비앤비와 함께 호캉스 #감성비앤비🏷경주로 떠날 계획이라면 #감성비앤비_경주사진출처: @from_jieun__ @2so_____l @21_pil @limi_lovely un_ny2#경주숙소 #경주독채숙소 #경주감성숙소 #감성숙소 #감상숙소추천 #경주독채펜션 #경주숙소추천 #경주여행 #경주가족여행 #숙조당",2021-03-30,7931,"['#경주_숙조당경주에', '#감성비앤비🏷경주로', '#감성비앤비_경주사진출처:', '#경주숙소', '#경주독채숙소', '#경주감성숙소', '#감성숙소', '#감상숙소추천', '#경주독채펜션', '#경주숙소추천', '#경주여행', '#경주가족여행', '#숙조당']['#경주_숙조당..경주', '#감성숙소_경주✔', '#감성숙소_경상북도...', '#경상북도', '#경주', '#숙조당-', '#경주여행', '#경주펜션', '#경주독채펜션', '#경주풀빌라', '#경주민박', '#경주독채민박', '#경북여행', '#경북독채펜션', '#독채펜션']",숙조당,0,경상북도 경주시 용강동 146-1
547,"#양양_써니사이드업강원도 양양에 위치한 인테리어가 예쁜 독채숙소 '써니사이드업' 카페와 함께 운영되고 있는 숙소로, 독채로 사용가능하며 2~4인까지만 이용가능한 곳입니다. 갯마을 해변 작은 언덕 위에 위치해있으며, 바쁜 생활 속에서 조금이나마 여유를 느끼고 삶의 여백을 잃지 않기를 바라며 만들어진 숙소입니다. 턴테이블이 구비되어있어, lp만이 갖는 자연스럽고 풍부한 음질로 노래를 들을 수 있으며, 1층 앞마당에는 실내 라운지에서 연장되는 넓은 테라스 데크가 조성되어있습니다. 그리고 웰컴와인과 추억을 간직할 수 있는 일회용필름카메라도 함께 제공됩니다. 넓고 이쁜 인테리어로 이루어진 공간에서 휴식을 취할 수 있는 공간————————————————써니사이드업위치: 강원도 양양군 현남면 갯마을길 42-33체크인: 15:00체크아웃: 11:00가격 : 400000원숙소문의: @sunnysideup_yangyang —————————————————🏷감성비앤비와 함께 호캉스 #감성비앤비🏷양양으로 떠날 계획이라면 #감성비앤비_양양사진출처 : @amor.jane @sua_ssi @balna392 @hu923#양양숙소 #강원도여행 #양양여행 #양양감성숙소 #강원도숙소 #강원도숙소추천 #강원도여행 #독채숙소 #독채숙소추천 #시골느낌숙소 #감성숙소추천 #커플숙소 #용인핫플 #써니사이드업",2021-03-29,213,"['#양양_써니사이드업강원도', '#감성비앤비🏷양양으로', '#감성비앤비_양양사진출처', '#양양숙소', '#강원도여행', '#양양여행', '#양양감성숙소', '#강원도숙소', '#강원도숙소추천', '#강원도여행', '#독채숙소', '#독채숙소추천', '#시골느낌숙소', '#감성숙소추천', '#커플숙소', '#용인핫플', '#써니사이드업']['#양양', '#강원도', '#써니사이드업', '#양양숙소', '#써니사이드업양양', '#양양여행', '#양양핫플', '#양양감성숙소', '#양양숙소추천']",써니사이드업,0,
548,"#밀양_제니의집밀양의 시내에서 조금 벗어난 상동면에 위치하고 있는 위치한 고즈넉한 시골의 풍경을 느낄 수 있는 독채 숙소 '제니의집' 60년 세월의 흔적을 간직하고 있는 농가주택으로, 옛모습 그대로를 살리고 보존하여 고향집을 닮은 집으로 리모델링 한 곳입니다.  새소리와 바람소리를 느끼며 가족과 친구, 연인끼리 오롯이 쉬었다 갈 수 있는 공간입니다. 빈티지한 인테리어로 옛날 시골집을 왔다는 느낌을 받을 수 있는 곳이며 소품 하나하나가 이쁘게 배치되어있습니다. 아침엔 수제토스트, 커피 및 허브차로 조식이 제공됩니다. 소박하고 느리게 사는 즐거움을 함께 느낄 수 있는 공간———————————————————제니의집 위치: 경남 밀양시 상동면 구곡길 86-1체크인: 14:00체크아웃: 12:00가격 : 100000원 (2명비수기기준)숙소문의: @jejongsug ———————————————————🏷감성비앤비와 함께 호캉스 #감성비앤비🏷밀양으로 떠날 계획이라면 #감성비앤비_밀양사진출처 : @1like42 @mini___bubu @_halovie @jjinjjiri @hanjoo_y #밀양숙소 #밀양여행 #감성숙소 #밀양숙소추천 #밀양감성숙소 #독채숙소 #독채숙소추천 #시골느낌숙소 #감성숙소추천 #커플숙소 #경남숙소 #제니의집",2021-03-28,1806,"['#밀양_제니의집밀양의', '#감성비앤비🏷밀양으로', '#감성비앤비_밀양사진출처', '#밀양숙소', '#밀양여행', '#감성숙소', '#밀양숙소추천', '#밀양감성숙소', '#독채숙소', '#독채숙소추천', '#시골느낌숙소', '#감성숙소추천', '#커플숙소', '#경남숙소', '#제니의집']['#밀양_제니의집..밀양', '#감성숙소_밀양✔', '#감성숙소_경상남도..', '#경상남도', '#밀양', '#제니의집-', '#밀양여행', '#밀양펜션', '#밀양독채펜션', '#경남펜션', '#경남여행', '#경남독채펜션', '#감성숙소', '#독채펜션', '#에어비앤비']['#밀양', '#제니의집', '#밀양숙소', '#밀양에어비앤비', '#밀양여행', '#밀양데이트', '#밀양핫플', '#숙소추천', '#감성숙소', '#에어비앤비숙소', '#부산근교여행', '#부산근교']",제니의집,0,경상남도 밀양시 상동면 안인리 523-1
549,"#제주_소목식탁제주 동쪽 끝 종달리에 위치하고있는 시골민박 '소목식탁'방에 들어서면 사장님께서 써주신 손편지가 놓여있으며, 직접 만드신 깜빠뉴와 감자스프 등으로 정성스럽게 준비해주시는 맛있는 조식은 이 숙소의 하이라이트입니다.소박하면서 깔끔하고 따뜻한 인테리어와 침대 옆으로 크고 시원하게 트인 창으로 푸릇푸릇한 잔디마당과 돌담뷰를 보실 수 있습니다. 따스한 햇살도 비오는 풍경마저도 빠져들 수 있는 곳입니다. 넓은 침대에 누워서 빔프로젝터로 영화도 보며 여유로운 하루를 보내실 수 있습니다.작고 예쁜 동네 속 머무르는 시간내내 따뜻한 조식 맛집————————————————소목식탁위치: 제주시 구좌읍 종달동길 29-23체크인: 16:00체크아웃: 10:30가격: 130000원 (성인 1인) 150000원(성인 2인)숙소문의: @somoktable기타: 조식서비스—————————————————🏷감성비앤비와 함께 호캉스 #감성비앤비🏷제주로 떠날 계획이라면 #감성비앤비_제주사진출처: @mingki__ @choi_kko @doong_trip @honey_been__ @__0_vely @luv.sunny__ @z.i__nii @cobalt_blue.__ @xieuny_ @bbogyo_#제주동쪽숙소 #종달리 #종달리숙소 #성산숙소 #제주조식숙소 #제주감성숙소 #제주감성숙소추천 #제주숙소 #제주스테이 #제주독채숙소 #제주숙소추천 #제주도숙소 #제주도감성숙소 #제주동쪽여행 #제주동쪽가볼만한곳 #소목식탁",2021-03-27,489,"['#제주_소목식탁제주', '#감성비앤비🏷제주로', '#감성비앤비_제주사진출처:', '#제주동쪽숙소', '#종달리', '#종달리숙소', '#성산숙소', '#제주조식숙소', '#제주감성숙소', '#제주감성숙소추천', '#제주숙소', '#제주스테이', '#제주독채숙소', '#제주숙소추천', '#제주도숙소', '#제주도감성숙소', '#제주동쪽여행', '#제주동쪽가볼만한곳', '#소목식탁']['#제주', '#소목식탁', '#제주숙소', '#제주도숙소', '#제주여행', '#제주데이트', '#제주핫플', '#숙소추천', '#감성숙소', '#종달리숙소', '#제주도감성숙소', '#제주시골민박']",소목식탁,0,제주특별자치도 제주시 구좌읍 종달리 739
550,"#대전_교토스탠다드대전 도룡동에 위치하고있는 '교토스탠다드'집 전체를 단독으로 사용하는 곳으로 호스트님의 감각적이고 디테일한 인테리어 센스가 돋보이는 공간이며, 예산에서 온 사과나무를 비롯한 녹색식물들과 오랜시간에 걸쳐서 교토에서 온 다양한 물건으로 채워진 곳입니다.입구에서부터 무성한 나무와 식물들이 숲 속에 온 듯한 느낌을 주며 문을 열고 실내로 들어오자마자 따뜻한 향기와 포근한 느낌을 느끼실 수 있습니다. 큰 창으로 들어오는 햇살과 밖의 초록 정원을 보고만 있어도 힐링이 되며 숙소 안에만 있어도 숙소 자체로 충분히 편안함과 따뜻함을 느낄 수 있는 공간입니다.살고싶은 집으로 삶의 쉼표가 되어줄 공간————————————————교토스탠다드위치: 대전 유성구 도룡동체크인: 15:00체크아웃: 11:00가격: 117000원 (평일기준, 수수료제외)숙소문의: @playburger—————————————————🏷감성비앤비와 함께 호캉스 #감성비앤비🏷대전으로 떠날 계획이라면 #감성비앤비_대전사진출처: @c_suaa @im_mimizzang @h_y_o_n_j @0hhyejin @hannak0701 @go.shy @nk.ung#대전에어비앤비 #대전 #대전숙소 #대전감성숙소 #감성숙소 #감성숙소추천 #에어비앤비 #에어비앤비추천 #대전여행 #교토스탠다드",2021-03-25,346,"['#대전_교토스탠다드대전', '#감성비앤비🏷대전으로', '#감성비앤비_대전사진출처:', '#대전에어비앤비', '#대전', '#대전숙소', '#대전감성숙소', '#감성숙소', '#감성숙소추천', '#에어비앤비', '#에어비앤비추천', '#대전여행', '#교토스탠다드']['#대전', '#교토스탠다드', '#대전숙소', '#대전여행', '#대전숙소추천', '#감성숙소', '#대전가볼만한곳', '#대전핫플', '#대전핫플레이스', '#교토감성', '#일본감성', '#감성숙소추천', '#에어비앤비']['#대전', '#교토스탠다드', '#집콕', '#교토', '#대전감성숙소', '#숙소하다_대전˳˳사진', '#숙소추천', '#대전숙소', '#에어비앤비', '#에어비앤비추천', '#에어비앤비대전']",교토스탠다드,0,
551,"#용인_방아리코테지용인의 따뜻한 시골동네에 위치하고 있는 '방아리코테지' 주방과 거실이 매력적인 공간 독채로 사용할 수 있는 공간이며, 겨실 가장자리엔 밖을 보며 휴식을 취할 수 있는 쇼파가 있고, 아기자기하게 만들어진 주방에는 여러가지 조리기구와 식기구가 준비되어있습니다. 인테리어와 소품 하나하나 정성들여 꾸며놓고 배치해두신 게 느껴질 만큼 이쁜 공간입니다. 다이닝룸도 있어서 오순도순 이야기를 나눌 수 있습니다. 와이파이와 인터넷이 따로 되지않아서 원래의 삶에서 벗어나 휴식을 취할 수 있는 공간입니다. 따뜻한 느낌을 받으며 온전히 나를 위한 휴식을 취할 수 있는 공간————————————————방아리코테지위치: 용인 (자세한 주소는 체크인 시 확인가능)체크인: 2:30체크아웃: 12:00가격 : 카카오톡 문의숙소문의: 카카오톡아이디(99jackie)—————————————————🏷감성비앤비와 함께 호캉스 #감성비앤비🏷전주로 떠날 계획이라면 #감성비앤비_용인사진출처 : @s.oyeonsu @uiii_s @haanseh @_seo.ha__#용인숙소 #용인여행 #용인감성숙소 #용인숙소추천 #독채숙소 #독채숙소추천 #시골느낌숙소 #감성숙소추천 #커플숙소 #용인핫플 #방아리코테지",2021-03-24,904,"['#용인_방아리코테지용인의', '#감성비앤비🏷전주로', '#감성비앤비_용인사진출처', '#용인숙소', '#용인여행', '#용인감성숙소', '#용인숙소추천', '#독채숙소', '#독채숙소추천', '#시골느낌숙소', '#감성숙소추천', '#커플숙소', '#용인핫플', '#방아리코테지']['#용인_방아리코테지..용인의', '#감성숙소_용인✔', '#감성숙소_경기도...', '#경기도', '#용인', '#방아리코테지-', '#용인여행', '#용인펜션', '#용인숙소', '#용인독채펜션', '#용인숙소', '#용인감성숙소', '#경기도여행', '#경기도여행코스']['#경기도', '#용인', '#방아리코테지', '#용인숙소', '#용인여행', '#감성숙소', '#시골집', '#시골감성', '#용인데이트', '#용인가볼만한곳']['#용인', '#방아리코테지', '#시골감성', '#용인숙소', '#숙소하다_용인', '#숙소하다_경기도', '#숙소추천', '#용인가볼만한곳', '#용인핫플', '#용인여행', '#감성숙소', '#서울근교여행', '#서울근교나들이']",방아리코테지,0,
552,"#제주_모노토너스제주 서쪽 시골마을에 위치한 바다가 보이는 독채 스테이 '모노토너스'2층 20평형 독채 1인 또는 2인전용숙소로 바다가 보이는 거실과 테라스, 주방, 화장실, 샤워실, 창문으로 햇살이 예쁘게 들어오면서 바다가 보이는 포근한 침실에서 행복한 시간을 보내실 수 있는 곳입니다.간단하게 드실 수 있도록 스프, 씨리얼, 우유, 주스, 커피가 들어있는 웰컴바구니를 준비해주셔서 햇볕이 잘 드는 바테이블이나 바다가 보이는 거실 테이블에서 조식으로 드시기 좋습니다.공간 하나하나 손길이 닿아 너무 예뻐서 예쁜 카페에 온 듯한 느낌을 받으실 수 있으며, 빔프로젝터로 영화를 보며 감성적인 시간을 보내실 수 있습니다.바다가 보이는 우리 집같은 편안하고 예쁜 공간————————————————모노토너스위치: 제주 서귀포시 대정읍 일주서로 2951-7체크인: 17:00체크아웃: 10:20가격: 120000원(평일기준)숙소문의: @monotonous_stay기타: 웰컴바구니—————————————————🏷감성비앤비와 함께 호캉스 #감성비앤비🏷제주로 떠날 계획이라면 #감성비앤비_제주사진출처: @o2.2am @_j._.jj @you_r_my__ @heartbongbong @suri0_0#제주서쪽숙소 #서귀포숙소 #서귀포숙소추천 #서귀포감성숙소 #제주감성숙소 #제주감성스테이 #제주숙소 #제주스테이 #제주독채스테이 #제주숙소추천 #제주커플숙소 #제주독채숙소 #제주서쪽여행 #모노토너스",2021-03-23,380,"['#제주_모노토너스제주', '#감성비앤비🏷제주로', '#감성비앤비_제주사진출처:', '#제주서쪽숙소', '#서귀포숙소', '#서귀포숙소추천', '#서귀포감성숙소', '#제주감성숙소', '#제주감성스테이', '#제주숙소', '#제주스테이', '#제주독채스테이', '#제주숙소추천', '#제주커플숙소', '#제주독채숙소', '#제주서쪽여행', '#모노토너스']['#제주_모노토너스..제주', '#감성숙소_서귀포✔', '#감성숙소_제주...', '#제주', '#서귀포', '#모노토너스-']",모노토너스,0,제주특별자치도 서귀포시 대정읍 일과리 1876-4
553,"#전주_라누이전주 객리단길에 위치하고 있는 모던 한옥숙소 '라누이' 라누이는 1940년에 건축한 한옥을 리모델링하여 고유의 고풍스러운 멋은 남기고, 편리하고 감각적인 인테리어를 더하여 만들어진 한옥 숙소입니다. 독채숙소로 전체공간을 사용하실 수 있기 때문에 사람들의 방해를 받지 않고 이용가능합니다. 2~4인이 넓고 편안하게 이용할 수 있는 규모인 라누이 본채와, 1~2인이 이용가능한 규모인 라누이블랑슈 별채로 이루어져있습니다. 두 숙소는 서로 독립된 건물이고, 중앙의 라누이정원을 공유합니다. 객리단길에 위치하여 있어서, 주변의 귀엽고 아기자기한 상점과 거리도 감상하실 수 있습니다. 한옥과 현대의 인테리어가 더하여 만들어진 한옥 숙소————————————————라누이위치: 전라북도 전주시 완산구 고사동체크인: 15:00체크아웃: 11:00가격 : 200000(라누이본채,평일기준)숙소문의: @hanok_lanuit —————————————————🏷감성비앤비와 함께 호캉스 #감성비앤비🏷전주로 떠날 계획이라면 #감성비앤비_전주사진출처 : @so_____oin @_jnnin @comelys_ @bxrxg @_narrra @da_g0g @recomend_yy #전주숙소 #전주여행 #전주감성숙소 #전주숙소추천 #전주한옥숙소 #전주객리단길숙소 #전주한옥마을숙소 #전주객리단길 #한옥숙소 #한옥숙소추천 #라누이 #전주라누이",2021-03-22,6544,"['#전주_라누이전주', '#감성비앤비🏷전주로', '#감성비앤비_전주사진출처', '#전주숙소', '#전주여행', '#전주감성숙소', '#전주숙소추천', '#전주한옥숙소', '#전주객리단길숙소', '#전주한옥마을숙소', '#전주객리단길', '#한옥숙소', '#한옥숙소추천', '#라누이', '#전주라누이']['#전주_라누이..1940년', '#감성숙소_전주✔', '#감성숙소_전라북도..', '#전라북도', '#전주', '#라누이', '#라누이블랑슈-', '#전주여행', '#전주한옥마을', '#한옥마을', '#전주숙소', '#전주펜션', '#전주한옥스테이', '#감성숙소', '#감성스테이', '#에어비앤비', '#전주에어비앤비', '#전주라누이', '#한옥스테이']['#전주', '#라누이', '#숙소기록', '#숙소기록_국내', '#숙소기록_전주⠀⠀⠀', '#숙소', '#숙소추천', '#국내숙소', '#여행', '#여행지추천', '#국내여행지추천', '#국내여행', '#여행스타그램', '#커플여행', '#가족여행', '#감성숙소', '#전주숙소', '#전주숙소추천', '#전주가볼만한곳', '#전주여행', '#전주감성숙소', '#전주핫플', '#전주핫플레이스', '#전주풀빌라', '#전주에어비앤비', '#전주독채펜션', '#전주펜션']['#전주', '#라누이', '#전주숙소', '#전주여행', '#전주숙소추천', '#전주감성숙소', '#객리단길숙소', '#전주한옥숙소']",라누이,0,
554,"#태안_파파홈충남 태안 산 속 깊이 위치하고 있는 감성 글램핑장 '파파홈' 1일 1팀만 숙박할 수 있는 프라이빗한 공간으로, 텐트+ 주택 안 침실 1개 + 욕실을 단독으로 이용하실 수 있습니다. 층고가 높은 노르디스크 텐트 속에서 감성캠핑을 즐기실 수 있으며 4인이 들어가도 넉넉한 크기의 텐트입니다. 텐트 내부에는 냉장고, 온풍기, 쇼파, 침대, 에어컨 등 다양한 가전과 캠핑용품들이 다 구비도어 있고, 바베큐도 할 수 있어서 완벽한 캠핑을 즐기실 수 있습니다. 장비 없이 감성캠핑을 즐길 수 있는 공간————————————————파파홈위치: 충청남도 태안군 태안읍 남문리 53-31체크인: 14:00체크아웃: 11:00가격 : 180000원(평일2인기준)숙소문의: @papahome_farmstay —————————————————🏷감성비앤비와 함께 호캉스 #감성비앤비🏷태안으로 떠날 계획이라면 #감성비앤비_태안사진출처 : @_sohee.e @hyemi.ss @yeonyi_i @su.____.jj @haneul_0924 @xxhcnue_#태안숙소 #태안여행 #감성캠핑 #감성캠핑추천 #태안감성숙소 #감성글램핑장 #글램핑장추천 #노르디스크텐트 #태안글램핑 #파파홈 #파파홈글램핑",2021-03-21,3758,"['#태안_파파홈충남', '#감성비앤비🏷태안으로', '#감성비앤비_태안사진출처', '#태안숙소', '#태안여행', '#감성캠핑', '#감성캠핑추천', '#태안감성숙소', '#감성글램핑장', '#글램핑장추천', '#노르디스크텐트', '#태안글램핑', '#파파홈', '#파파홈글램핑']['#태안_파파홈..시골의', '#감성숙소_태안✔', '#감성숙소_충청남도..', '#충청남도', '#태안', '#파파홈-', '#태안여행', '#태안펜션', '#태안캠핑장', '#태안독채펜션', '#충남펜션', '#충남여행', '#충남독채펜션', '#글램핑', '#감성숙소', '#에어비앤비', '#팜스테이']['#태안', '#파파홈', '#태안숙소', '#태안여행', '#태안데이트', '#태안핫플', '#숙소추천', '#감성숙소', '#에어비앤비', '#태안글램핑']",파파홈,0,충청남도 태안군 태안읍 남문리 53-31
555,"#제주_드렌도트제주 애월에 위치하고 있는 '드렌도트'드렌도트는 draine + dot 의 합성어로 주어진 땅과 풍경에 기대어 살지만 그것을 재해석하고 마음으로 받아들여 다시 나누어 살아가는 우리라는 뜻으로 제주의 모습을 소중히 간직한 공간을 공유하는 곳입니다.총 2동으로 한 동은 2인스테이와 공용공간이 있고, 한 동은 독채스테이입니다. 2인스테이가 있는 건물의 경우 전체공간이 8개의 유닛으로 나눠져있고 4개의 공간은 스테이, 4개의 공간은 공용공간으로 구성되어있습니다. 2가지 타입의 객실이 있으며, 전 객실 햇살이 정말 잘 들어오며 창문으로 푸릇푸릇함, 돌담, 동백꽃 등 제주를 담고있어 힐링하실 수 있습니다.공용공간으로 카페드렌, 개방형 라운지, 옥상, 유리온실이 있어 여유롭게 제주를 즐기고 휴식하실 수 있습니다. 카페드렌에선 매일 아침 사장님께서 직접 준비해주시는 정성가득한 조식을 드실 수 있으며, 옥상 한 켠의 아담한 유리온실에서 간단한 티타임을 즐기실 수 있습니다.미니멀하면서도 제주의 감성을 가득 담고 있는 곳————————————————드렌도트위치: 제주시 애월읍 애원로 246체크인: 17:00체크아웃: 11:00가격: 150000원 (평일)숙소문의: @draindot.jeju기타: 조식—————————————————🏷감성비앤비와 함께 호캉스 #감성비앤비🏷제주로 떠날 계획이라면 #감성비앤비_제주사진출처: @heonlo.qb @jinddami__s2 @00.11.24_khj @dassomingx_x @ezyeunfilm @meok_meok_o.o @ha__ena @yualize @merry_dajeong#제주서쪽숙소 #애월숙소 #애월숙소추천 #애월감성숙소 #제주감성숙소 #제주감성스테이 #제주숙소 #제주스테이 #제주독채스테이 #제주숙소추천 #제주커플숙소 #제주독채숙소 #제주서쪽여행 #draindot #드렌도트",2021-03-18,552,"['#제주_드렌도트제주', '#감성비앤비🏷제주로', '#감성비앤비_제주사진출처:', '#제주서쪽숙소', '#애월숙소', '#애월숙소추천', '#애월감성숙소', '#제주감성숙소', '#제주감성스테이', '#제주숙소', '#제주스테이', '#제주독채스테이', '#제주숙소추천', '#제주커플숙소', '#제주독채숙소', '#제주서쪽여행', '#draindot', '#드렌도트']['#제주_드렌도트..제주의', '#감성숙소_애월읍✔', '#감성숙소_제주...', '#제주', '#애월', '#드렌도트-']['#제주', '#드렌도트', '#제주숙소', '#제주여행', '#제주가볼만한곳', '#감성숙소', '#제주핫플', '#제주감성숙소', '#제주도숙소', '#제주도', '#제주도여행', '#제주도핫플레이스']",드렌도트,0,제주특별자치도 제주시 애월읍 납읍리 1909-3
