,content,date,like,tags,name,overlap,place
420,"#부산 #nnnn 부산 전포동의 위치한 감성숙소, nnnn입니다.nnnn은 아늑하고 따뜻한 분위기가 주를 이루는 숙소입니다. 들어서자마자 주방이 보이고, 하얀 커튼을 열면 푹신한 침대를 만날 수 있습니다. 침대 옆에는 차를 마실 수 있는 공간이 마련되어 있어 여유롭게 한 잔 즐기시면 좋을 것 같아요. 가파른 계단을 따라 올라가면 이곳의 하이라이트인 타자기를 칠 수 있는 공간과 LP판으로 음악을 들을 수 있는 공간이 마련되어 있답니다. 음악을 들으며 타자기로 그 날의 일기를 써보시길 바래요 :) 빈티지한 감성이 가득한 숙소를 좋아하시는 분들께 안성맞춤이랍니다 ✧*⁎🪄이런 분들에게 추천해드려요✧#아날로그감성 이 가득한 숙소를 찾는 분✧#부산감성숙소 를 찾는 분__ __ __ __ __ __ __ __ __ __ __ __ 주소: 부산 전포동 (예약 후 안내)체크인: 16:00 / 체크아웃: 11:00숙소문의: @nnnn_busan __ __ __ __ __ __ __ __ __ __ __ __ 💡여행지보다 숙소를 먼저 고르는 에디터가 추천해주는#숙소하다_부산˳˳사진 출처:  @s_13248619 @030bbbbb @tmxxnjs @yualize @_eivom_ #부산여행 #부산숙소 #부산숙소추천 #전포동숙소 #서면숙소 #부산에어비앤비 #에어비앤비부산 #에어비앤비추천 #감성숙소 #nnnn부산",2021-08-27,22,"['#부산', '#nnnn', '#아날로그감성', '#부산감성숙소', '#숙소하다_부산˳˳사진', '#부산여행', '#부산숙소', '#부산숙소추천', '#전포동숙소', '#서면숙소', '#부산에어비앤비', '#에어비앤비부산', '#에어비앤비추천', '#감성숙소', '#nnnn부산']",아날로그감성,0,
421,"#완주 #소양고택 카페와 책방까지 함께 운영되는 완주의 고즈넉한 한옥스테이, 소양고택입니다.소양고택은 산을 바라보는 곳에 위치해있어 마운틴뷰를 원없이 즐길 수 있는 곳입니다. 플리커책방과 두베카페도 숙소와 함께 운영되고  있는데요 ! 책방에선 한적하게 책을 읽을 수 있고, 카페에선 웰컴드링크와 조식을 드실 수 있다고 해요. 조식은 누룽지와 전라도 한식차림으로 제공되며, 후식까지 드실 수 있다고 합니다. 아침에 일찍 오셔서 창가 자리 쪽에서 즐겨보시길 바래요! 고즈넉한 이곳에서 하루동안 별과 달, 자연을 감상하고 풀벌레 소리를 들으며 여유로운 추억을 남겨보시길 바랍니다 ෆ•̀ᴗ•́ෆ🪄이런 분들에게 추천해드려요✧고즈넉한 #한옥스테이 를 찾는 분✧자연 속에서 머물 수 있는 #힐링숙소 를 찾는 분__ __ __ __ __ __ __ __ __ __ __ __ 주소: 전북 완주군 소양면 송광수만로 472-23체크인: 16:30 / 체크아웃: 10:30숙소인스타: @dubhe_soyang 가격: 220,000 ~__ __ __ __ __ __ __ __ __ __ __ __ 💡여행지보다 숙소를 먼저 고르는 에디터가 추천해주는#숙소하다_완주 #숙소하다_전라북도˳˳사진 출처: @_____by.min @keeeplight @djddoc @g_crystal_ #완주숙소 #완주카페 #소양고택한옥스테이 #전주숙소 #전주한옥숙소 #한옥숙소 #뷰맛집숙소 #숙소추천",2021-08-26,35,"['#완주', '#소양고택', '#한옥스테이', '#힐링숙소', '#숙소하다_완주', '#숙소하다_전라북도˳˳사진', '#완주숙소', '#완주카페', '#소양고택한옥스테이', '#전주숙소', '#전주한옥숙소', '#한옥숙소', '#뷰맛집숙소', '#숙소추천']",소양고택,0,
422,"#태안 #더클래식펜션 청포대 해수욕장과 가까이 위치한 태안 숙소, 더클래식펜션입니다. 태안더클래식펜션은 객실에서 탁 트인 서해 바다를 볼 수 있는 곳 입니다. 이곳에 머무신다면, 바다전망을 보며 스파를 즐길 수 있는 룸을 추천해드려요 :) 창문에 걸터 앉아, 일몰을 감상하며 인생샷까지 남겨보시길 바랍니다 ♡🪄이런 분들에게 추천해드려요✧#서해바다 를 보며 힐링하고 싶은 분✧#일몰맛집 숙소를 찾는 분__ __ __ __ __ __ __ __ __ __ __ __ 주소: 충남 태안군 남면 청포대길 57-60 태안더클래식스파펜션체크인: 15:00 / 체크아웃: 11:00숙소인스타: @theclassicpension 가격: 120,000~__ __ __ __ __ __ __ __ __ __ __ __ 💡여행지보다 숙소를 먼저 고르는 에디터가 추천해주는#숙소하다_태안 #숙소하다_충청남도˳˳사진 출처: @theclassicpension @wonleeji__ @didiyamm @hwanhee_fanini @su7_hee @j._.jiiii1 @deer_rogi #국내숙소 #숙소추천 #태안여행 #태안가볼만한곳 #태안가족펜션 #태안숙소 #태안펜션 #태안펜션추천 #오션뷰펜션 #스파펜션추천",2021-08-24,31,"['#태안', '#더클래식펜션', '#서해바다', '#일몰맛집', '#숙소하다_태안', '#숙소하다_충청남도˳˳사진', '#국내숙소', '#숙소추천', '#태안여행', '#태안가볼만한곳', '#태안가족펜션', '#태안숙소', '#태안펜션', '#태안펜션추천', '#오션뷰펜션', '#스파펜션추천']",더클래식펜션,0,울산광역시 울주군 서생면 진하리 83-18
423,"#춘천 #썸원스페이지숲 숲멍하기 좋은 춘천의 북스테이, 썸원스페이지숲입니다. 썸원스페이지숲은 책과 나무 그리고 별을 보며 쉴 수 있는 힐링 숙소입니다. 혼자 잘 수 있는 1인 방부터 최대 4인까지 가능한 개인 서재가 있는 방, 그리고 최대 2인이 머무르기 좋은 아늑한 방으로 이루어져 있습니다. 공용공간인 서재에는 다양한 컨셉의 책들로 가득채워져 있는데요! 마음에 드는 책들을 빌려 마음껏 읽어볼 수 있답니다. 사장님께서 자전거도 무료로 빌려주신다고 하니 숙소 앞 시골길을 따라 달리며 자연을 느껴보시길 바래요 :) 푹 쉬며 숲멍하기 좋은 춘천의 북스테이로 추천해드립니다◞✧🪄이런 분들에게 추천해드려요✧#숲멍 하며 힐링의 시간을 보내고 싶은 분✧자연이 있는 #북스테이 를 찾는 분__ __ __ __ __ __ __ __ __ __ __ __ 주소: 강원 춘천시 신동면 삼포길 155체크인: 16:00 / 체크아웃: 11:00가격: 100,000~ (기준인원, 성수기에 따라 상이)숙소인스타: @someonespage_forest __ __ __ __ __ __ __ __ __ __ __ __ 💡여행지보다 숙소를 먼저 고르는 에디터가 추천해주는#숙소하다_춘천 #숙소하다_강원도˳˳사진 출처: @mangg_so @cham.ni @_k_kyu @lovele__e #춘천여행 #춘천가볼만한곳 #춘천숙소 #춘천숙소추천 #춘천펜션 #힐링숙소 #숲뷰숙소 #숙소추천 #감성숙소",2021-08-18,36,"['#춘천', '#썸원스페이지숲', '#숲멍', '#북스테이', '#숙소하다_춘천', '#숙소하다_강원도˳˳사진', '#춘천여행', '#춘천가볼만한곳', '#춘천숙소', '#춘천숙소추천', '#춘천펜션', '#힐링숙소', '#숲뷰숙소', '#숙소추천', '#감성숙소']",썸원스페이지숲,0,강원도 춘천시 신동면 증리 68
424,"#제주도 #야호비치하우스 함덕 서우봉 해변에 위치한 뷰맛집 숙소, 야호비치하우스입니다. 야호비치하우스는 복층구조로 이루어져 있는데요! 1층은 거실, 주방, 테라스가 있고 2층에 바로 이곳의 하이라이트인 오션뷰 침실이 있답니다. 푸르른 함덕 해변과 제주도의 야자수를 가까이 두고 잠들 수 있는 침실이랍니다. 파도소리 들으며 하루를 보내고, 파란빛 제주의 바다를 배경으로 인생샷을 찍고 싶은 분들은 야호비치하우스로 오세요 ʚ❤︎ɞ🪄이런 분들에게 추천해드려요✧#제주도오션뷰 펜션을 찾는 분✧#제주도인생샷 을 남기고 싶은 분__ __ __ __ __ __ __ __ __ __ __ __ 주소: 제주 제주시 조천읍 조함해안로 582체크인: 15:00 / 체크아웃: 11:00가격: 160,000~__ __ __ __ __ __ __ __ __ __ __ __ 💡여행지보다 숙소를 먼저 고르는 에디터가 추천해주는#숙소하다_제주도˳˳사진 출처: @jinnlike @ssuareeziillla @sue_s2 @hwang_o.o #제주도숙소 #제주도숙소추천 #제주도펜션추천 #제주오션뷰숙소 #조천숙소 #조천읍숙소 #뷰맛집숙소 #감성숙소 #숙소추천 #제주숙소추천 #제주도오션뷰펜션 #제주도여행 #제주여행추천 #제주감성숙소 #제주도감성숙소 #제주뷰맛집",2021-08-17,18,"['#제주도', '#야호비치하우스', '#제주도오션뷰', '#제주도인생샷', '#숙소하다_제주도˳˳사진', '#제주도숙소', '#제주도숙소추천', '#제주도펜션추천', '#제주오션뷰숙소', '#조천숙소', '#조천읍숙소', '#뷰맛집숙소', '#감성숙소', '#숙소추천', '#제주숙소추천', '#제주도오션뷰펜션', '#제주도여행', '#제주여행추천', '#제주감성숙소', '#제주도감성숙소', '#제주뷰맛집']",야호비치하우스,0,제주특별자치도 제주시 조천읍 함덕리 215-6
425,"#안성 #오담하루에 한팀! 한옥 전체를 독채로 사용할 수 있는 숙소, 오담입니다. 제가 생각한 오담 펜션의 매력은 아름다운 뷰보며 차를 마실 수 있는 파고라에요🏡주인분께서 직접 내려 마실 수 있는 원두를 준비해 주시기 때문에 커피 마시며인생사진 10000장 찍을 수 있는 공간입니다☕ ✔편백나무로 지어진 침실 ✔바베큐가 가능한 야외공간✔음식 조리가 가능한 파고라 3공간으로 나눠어져 있어요. 마당도 넓어서 가족단위로 오셔도 안성맞춤인 숙소라고 생각합니다ㅎㅎ심지어 밤에는 조명으로 더 예뻐지는 곳!별 구경도 하고✨마당에서는 불멍도 가능해서🔥천국이 따로 없습니다...( ⁎ ᵕᴗᵕ ⁎ ) 나만의 공간에서 감성적인 하루 보내고 싶으신 분에게 추천 드려요🌿 🪄이런 분들에게 추천해드려요✧인생샷을 남길 수 있는 #안성숙소 를 찾는 분✧#뷰맛집숙소 에서 힐링하고 싶은 분✧고즈넉한 #한옥펜션 을 찾는 분__ __ __ __ __ __ __ __ __ __ __ __ 주소: 경기 안성시 대덕면 하모산길 21-5체크인: 15:00 / 체크아웃: 11:00숙소문의 : https://blog.naver.com/saming2 __ __ __ __ __ __ __ __ __ __ __ __ 💡여행지보다 숙소를 먼저 고르는 에디터가 추천해주는#숙소하다_안성 #숙소하다_경기도 ˳˳사진.글 제공 : @minji_20524 #안성여행 #안성가볼만한곳 #안성데이트 #안성숙소추천 #독채펜션 #독채펜션추천 #한옥펜션추천 #한옥숙소 #독채숙소",2021-07-30,22,"['#안성', '#오담하루에', '#안성숙소', '#뷰맛집숙소', '#한옥펜션', '#숙소하다_안성', '#숙소하다_경기도', '#안성여행', '#안성가볼만한곳', '#안성데이트', '#안성숙소추천', '#독채펜션', '#독채펜션추천', '#한옥펜션추천', '#한옥숙소', '#독채숙소']",오담하루에,0,
426,"#하동 #켄싱턴리조트하동 자연을 소재로 디자인된 하동의 에코리조트, 켄싱턴리조트입니다.켄싱턴리조트에서 특히 추천해드리는 룸은 '켄싱턴 디럭스 스파' 입니다. 디럭스 스파 객실에는 야외 발코니에 편백나무로 만들어진 스파가 있어서 인기가 많은데요! 푸르른 지리산뷰를 보며 즐길 수 있다는 것이 매력포인트입니다. 침대에서도 탁트인 지리산 뷰를 보실 수 있기에 자연 속에서 쉬고, 힐링하고 싶은 분들께 안성맞춤인 숙소에요. 객실 내에는 녹차를 마실 수 있는 다기세트가 있어 발코니에 있는 테이블이나 스파를 즐기며 드셔보시길 바랍니다 :)🪄이런 분들에게 추천해드려요✧#마운틴뷰 숙소를 찾는 분✧#지리산뷰 를 보며 스파를 즐기고 싶은 분__ __ __ __ __ __ __ __ __ __ __ __ 주소: 경남 하동군 화개면 쌍계로 532-6체크인: 15:00 / 체크아웃: 11:00숙소인스타: @kensingtonhadong_resort __ __ __ __ __ __ __ __ __ __ __ __ 💡여행지보다 숙소를 먼저 고르는 에디터가 추천해주는#숙소하다_하동 #숙소하다_경상남도˳˳사진 출처: @lia.umma @lia__424j @s0_eeeee @_n.rasol @___jieon2 #하동여행 #하동여행코스 #하동숙소 #리조트추천 #마운틴뷰숙소 #초록뷰 #뷰맛집숙소 #감성숙소 #숙소추천 #여름여행",2021-07-23,27,"['#하동', '#켄싱턴리조트하동', '#마운틴뷰', '#지리산뷰', '#숙소하다_하동', '#숙소하다_경상남도˳˳사진', '#하동여행', '#하동여행코스', '#하동숙소', '#리조트추천', '#마운틴뷰숙소', '#초록뷰', '#뷰맛집숙소', '#감성숙소', '#숙소추천', '#여름여행']",켄싱턴리조트하동,0,경상남도 하동군 화개면 운수리 384-17
427,#제주도 #한경면숙소 애월편에 이은 제주도 숙소 추천 두 번째!제주의 풍경을 즐길 수 있는 숙소뿐만 아니라 조식 맛집으로 유명한 숙소까지 만나보세요 :)#소공원스테이 #조수리플로어 #오오오하우스 #클랭블루스테이 #꽃신민박 💡여행지보다 숙소를 먼저 고르는 에디터가 추천해주는#숙소하다_제주도 ˳˳사진 출처: @suubin.n @hhhye_in2 @sonyunmi__ @allabout.mytime @hhyunseoo @in__0202 @s.__.yeonnn @yerrrr__#제주도숙소 #제주숙소추천 #제주감성숙소 #제주커플숙소 #제주뷰맛집 #조식맛집 #제주일몰 #숙소추천 #감성숙소 #제주수영장펜션 #제주스파펜션,2021-07-22,32,"['#제주도', '#한경면숙소', '#소공원스테이', '#조수리플로어', '#오오오하우스', '#클랭블루스테이', '#꽃신민박', '#숙소하다_제주도', '#제주도숙소', '#제주숙소추천', '#제주감성숙소', '#제주커플숙소', '#제주뷰맛집', '#조식맛집', '#제주일몰', '#숙소추천', '#감성숙소', '#제주수영장펜션', '#제주스파펜션']",한경면숙소,0,
428,#제주도 #애월숙소 제주도 애월에 위치한 감성 가득한 숙소들을 모아봤습니다 💛앞으로 쭉~ 제주도 숙소를 지역별로 추천해드릴테니 많은 관심 부탁드려요 '◡'✿#드렌도트 #볼수록제주 #이티하우스 #솔트애월 #애월기록 💡여행지보다 숙소를 먼저 고르는 에디터가 추천해주는#숙소하다_제주도˳˳사진 출처: @heonlo.qb @hyangg2___ @yean_doo @sephzu @_d.ongeuny #국내여행 #제주도여행코스 #제주도숙소추천 #제주오션뷰숙소 #제주도감성숙소 #제주도독채펜션 #제주숙소추천 #제주뷰맛집 #제주도숙소 #제주도민박 #제주도펜션 #제주도게스트하우스 #감성숙소 #숙소추천 #애월숙소추천,2021-07-06,23,"['#제주도', '#애월숙소', '#드렌도트', '#볼수록제주', '#이티하우스', '#솔트애월', '#애월기록', '#숙소하다_제주도˳˳사진', '#국내여행', '#제주도여행코스', '#제주도숙소추천', '#제주오션뷰숙소', '#제주도감성숙소', '#제주도독채펜션', '#제주숙소추천', '#제주뷰맛집', '#제주도숙소', '#제주도민박', '#제주도펜션', '#제주도게스트하우스', '#감성숙소', '#숙소추천', '#애월숙소추천']",애월숙소,0,
429,"#제주도 #만희민박 제주도 해안가 마을에 위치한 숙소, 만희민박입니다. 만희민박은 40년 넘은 제주의 고택을 개조한 숙소인데요. 카페와 함께 운영되기 때문에 다른 카페를 찾으러 멀리 나가지 않고 편하게 커피를 즐기실 수 있는 곳입니다. 기준 인원 3인, 최대 인원 4인이 사용가능한 만희 민박과 2인 전용 독채 숙소로 최근 오픈한 둘의 만희로 이루어져 있습니다. 2인이 만희 민박을 예약해도 독채로 사용 가능하니 참고해주세요 :) 숙소 안에서 제주의 바다를 보실 수 있으며, 돌담으로 둘러싸여 프라이빗하게 즐길 수 있는 수영장이 있습니다. 푸른 잔디밭이 있는 정원까지 제주스러움이 가득한 만희 민박에서 행복한 제주 여행을 보내보세요 !🪄이런 분들에게 추천해드려요✧#제주도수영장 숙소를 찾는 분✧#구좌숙소 를 찾는 분✧제주스러움이 가득한 #제주숙소 를 찾는 분__ __ __ __ __ __ __ __ __ __ __ __ 주소: 제주 제주시 구좌읍 해맞이해안로 1112체크인: 16:00 / 체크아웃: 10:30숙소문의: @cafemani_bin __ __ __ __ __ __ __ __ __ __ __ __ 💡여행지보다 숙소를 먼저 고르는 에디터가 추천해주는#숙소하다_제주도˳˳사진 출처: @rlo._.me @berry_ssum @wouldyoulike___ #제주도숙소 #제주도숙소추천 #제주숙소추천 #제주감성숙소 #제주카페 #구좌카페 #숙소추천 #제주여행 #제주가볼만한곳 #제주도포토존",2021-06-14,22,"['#제주도', '#만희민박', '#제주도수영장', '#구좌숙소', '#제주숙소', '#숙소하다_제주도˳˳사진', '#제주도숙소', '#제주도숙소추천', '#제주숙소추천', '#제주감성숙소', '#제주카페', '#구좌카페', '#숙소추천', '#제주여행', '#제주가볼만한곳', '#제주도포토존']",만희민박,0,제주특별자치도 제주시 구좌읍 평대리 2033-1
430,#여름휴가 는 여기로! #여수풀빌라 1. #슈가브리움 -전남 여수시 돌산읍 몰둠벙길 582. #라테라스리조트 -전남 여수시 돌산읍 진모1길 29-123. #웨스트힐스 -전남 여수시 돌산읍 몰둠벙길 22-94. #블루망고풀빌라 -전남 여수시 돌산읍 계동해안길 905. #비고리조트 -전남 여수시 돌산읍 돌산로 3155-16. #르그랑블루 -전남 여수시 돌산읍 무술목길 34💡여행지보다 숙소를 먼저 고르는 에디터가 추천해주는#숙소하다_여수˳˳사진 출처: @by.jumi @sssum_96 @___eunha___ @_h.ee_ @mond.ss @yeounjin.bb #여수여행 #여수가볼만한곳 #여수숙소 #여수펜션 #여수리조트 #여수호텔 #여수풀빌라추천 #풀빌라추천 #여름휴가추천 #여름휴가지추천,2021-06-04,24,"['#여름휴가', '#여수풀빌라', '#슈가브리움', '#라테라스리조트', '#웨스트힐스', '#블루망고풀빌라', '#비고리조트', '#르그랑블루', '#숙소하다_여수˳˳사진', '#여수여행', '#여수가볼만한곳', '#여수숙소', '#여수펜션', '#여수리조트', '#여수호텔', '#여수풀빌라추천', '#풀빌라추천', '#여름휴가추천', '#여름휴가지추천']",여수풀빌라,0,
431,"#제주도 #그리니제주 #고요한오후 귤밭 앞에 위치한 제주도 감성숙소, 그리니제주 / 고요한오후입니다. 그리니제주와 고요한오후는 200평 대지의 귤밭에 위치한 숙소입니다. 그리니제주는 2인에서 최대 4인이 머무를 수 있고, 고요한오후는 2인만이 머무를 수 있다고 합니다. 두 곳 모두 숙소 곳곳에서 귤밭뷰를 볼 수 있습니다. (´•᎑•`)♡주변이 모두 귤밭, 청보리밭, 콩밭이라 일행과 함께 제주를 느끼며 산책하셔도 좋을 것 같아요:) 🪄이런 분들에게 추천해드려요✧#제주감귤 뷰를 보며 쉬다가고 싶은 분✧제주의 감성이 가득 담긴 #제주감성숙소 를 찾는 분✧화이트+우드톤으로 따뜻한 분위기를 느낄 수 있는 #제주숙소 를 찾는 분__ __ __ __ __ __ __ __ __ __ __ __ 주소: 제주 서귀포시 안덕면 덕수동로 149-21체크인: 16:00 / 체크아웃: 11:00가격: 그리니제주 평수기 2인기준 1박 22만원고요한오후 1박 18만원 (평일/주말/성수기 동일)숙소문의: @greeny_jeju __ __ __ __ __ __ __ __ __ __ __ __ 💡여행지보다 숙소를 먼저 고르는 에디터가 추천해주는#숙소하다_제주도˳˳사진 출처: @camper_ri @soooming_ming @ddooyeonn #국내여행 #제주도여행 #제주여행 #숙소추천 #감성숙소 #제주도숙소 #제주도감성숙소 #제주도감귤 #제주도가볼만한곳 #제주도핫플",2021-05-30,25,"['#제주도', '#그리니제주', '#고요한오후', '#제주감귤', '#제주감성숙소', '#제주숙소', '#숙소하다_제주도˳˳사진', '#국내여행', '#제주도여행', '#제주여행', '#숙소추천', '#감성숙소', '#제주도숙소', '#제주도감성숙소', '#제주도감귤', '#제주도가볼만한곳', '#제주도핫플']",그리니제주,0,제주특별자치도 서귀포시 안덕면 덕수리 1262-5
432,#초록뷰 #힐링숙소 자연 속에 위치한 숙소에서 초록뷰를 보며 힐링해보는 건 어떨까요? 1. #갤러리가덕 -부산 강서구 서천로42번길 52-322. #과수원집소원재 -제주 서귀포시 남원읍 남한로 418-113. #지례예술촌 -경북 안동시 임동면 지례예술촌길 4274. #폴개우영 -제주 서귀포시 남원읍 태위로894번길 135. #향초목원 -강원 삼척시 가곡면 탕곡길 473-174💡여행지보다 숙소를 먼저 고르는 에디터가 추천해주는#숙소하다_부산 #숙소하다_제주도 #숙소하다_안동 #숙소하다_삼척˳˳사진 출처: @aahn_x @m.u.n_j @ssr_a @sol_a_ya @gil___dong #국내숙소 #숙소추천 #부산숙소 #제주도숙소 #안동숙소 #삼척숙소 #뷰맛집 #숲캉스 #마운틴뷰 #포토존 #인생샷 #인생샷명소 #감성숙소 #여행지추천,2021-05-27,44,"['#초록뷰', '#힐링숙소', '#갤러리가덕', '#과수원집소원재', '#지례예술촌', '#폴개우영', '#향초목원', '#숙소하다_부산', '#숙소하다_제주도', '#숙소하다_안동', '#숙소하다_삼척˳˳사진', '#국내숙소', '#숙소추천', '#부산숙소', '#제주도숙소', '#안동숙소', '#삼척숙소', '#뷰맛집', '#숲캉스', '#마운틴뷰', '#포토존', '#인생샷', '#인생샷명소', '#감성숙소', '#여행지추천']",힐링숙소,0,
433,"#경주 #한옥숙소 경주 여행, 고즈넉한 한옥스테이에서 머물면서 한옥의 매력을 듬뿍 느껴보세요:) 1. #소소정 -경북 경주시 사정로50번길 102. #소설재 -경북 경주시 포석로1050번길 483. #흐르는결 -경북 경주시 포석로1092번길 62-44. #소이한옥 -경북 경주시 첨성로81번길 22-65. #라궁호텔 -경상북도 경주시 엑스포로 55-126. #최부가830한옥펜션 -경북 경주시 남간길 85-4 경덕사 바로 옆7. #더나인펜션 -경북 경주시 충효서악길 87💡여행지보다 숙소를 먼저 고르는 에디터가 추천해주는#숙소하다_경주 #숙소하다_경상북도˳˳#국내여행 #경주여행 #경주숙소 #경주숙소추천 #경주한옥펜션 #경주한옥숙소 #경주한옥스테이 #한옥스테이 #경주황리단길 #경주핫플 #숙소추천",2021-05-20,32,"['#경주', '#한옥숙소', '#소소정', '#소설재', '#흐르는결', '#소이한옥', '#라궁호텔', '#최부가830한옥펜션', '#더나인펜션', '#숙소하다_경주', '#숙소하다_경상북도˳˳', '#국내여행', '#경주여행', '#경주숙소', '#경주숙소추천', '#경주한옥펜션', '#경주한옥숙소', '#경주한옥스테이', '#한옥스테이', '#경주황리단길', '#경주핫플', '#숙소추천']",한옥숙소,0,
434,"#강릉 #느린가 느린가(구 #하슬라스테이 )는 강릉 교동에 위치한 한옥 스테이입니다. 대문을 열고 들어가면 직접 제작한 테이블과 의자를 보실 수 있습니다. 이곳에서 아침에 따뜻한 차 한 잔 마시며 하루를 시작해보는 건 어떨까요? 침실에서는 통창 너머로 대나무와 감나무를 보실 수 있다고 합니다. 이곳에 걸터앉아 사진을 찍으면서 #인생샷 을 남겨보세요:) 숙소 안에서 취사는 불가능하지만 가져온 음식을 예쁘게 플레이팅 할 수 있는 식기들은 마련되어 있다고 합니다. 거실에서 빔프로젝트로 영화를 보면서, 혹은 턴테이블에서 흘러나오는 노래를 들으며 감성있게 식사를 즐겨보시길 바랍니다. 🪄이런 분들에게 추천해드려요✧#한옥스테이 에서 달콤한 휴식을 취하고 싶은 분✧#턴테이블 에서 흘러나오는 노래를 들으며 여유로운 하루를 보내고 싶은 분✧다락과 마당 테이블에서 차 한 잔 즐길 수 있는 #강릉감성숙소 를 찾는 분__ __ __ __ __ __ __ __ __ __ __ __ 주소: 강원 강릉시 원대로26번길 11체크인: 16:00 / 체크아웃: 11:00 숙소문의: @slowhouse.ng__ __ __ __ __ __ __ __ __ __ __ __ 💡여행지보다 숙소를 먼저 고르는 에디터가 추천해주는#숙소하다_강릉 #숙소하다_강원도˳˳사진 출처: @slowhouse.ng @hisilisili @_ja.0_ #국내여행 #강릉여행 #강릉숙소 #강릉숙소추천 #여행스타그램 #여행지추천 #강릉가볼만한곳 #강릉펜션",2021-05-01,9,"['#강릉', '#느린가', '#하슬라스테이', '#인생샷', '#한옥스테이', '#턴테이블', '#강릉감성숙소', '#숙소하다_강릉', '#숙소하다_강원도˳˳사진', '#국내여행', '#강릉여행', '#강릉숙소', '#강릉숙소추천', '#여행스타그램', '#여행지추천', '#강릉가볼만한곳', '#강릉펜션']",느린가,0,
