,content,date,like,place,tags,unix,imgUrl
23,"오로지 쉼을 위한 곳, 별이 그 어디보다 잘 보이는 산속 깊숙한 숙소 🏠#양양 #팜11스테이 ✨⠀-⠀자연으로 둘러싸여 먼 산등성을 바라보고밤에는 밤하늘을 가득 메운 별들을 바라보고연인과 혹은 친구와 프라이빗한 독채숙소에서오랜만에 못했던 긴 이야기를 나누고단둘만의 시간을 보내기 너무 좋은 곳...💜요즘 제일 핫한 양양 해변들과 달리숲속 깊은 곳에 자리한 조용하고 고요한 펜션'팜11스테이' 💛⠀바베큐 금지, 취사 금지, 금연 등제재가 많지만그만큼의 가치가 있기에 인기가 많은 곳!진정한 휴식이 가능한 숙소에요🌱팜11스테이는 베이커리&레스토랑도 함께 운영하고 있어서자연으로 키운 재료들로 만든 음식들도 즐길 수 있답니다!⠀📍 주소강원도 양양군 서면 논화리 46⠀💡 Tip🔸 3동으로 이루어진 독채숙소🔸 입실 16:00~ 퇴실 11:00🔸 무료 음료 쿠폰 제공⠀🌿 숙소기록위치 : 근처에 마트편의점 없음, 양양서피비치 차량 20분가격 : 25만원부터~특징 : 노키즈존, 냄새심한 음식 취식 불가, 애견 동반 금지 *야생고양이가 있어요!⠀⠀-⠀국내외 예쁜 숙소 정보는 #숙소기록 🌿숙소 제보는 DM 또는 이메일로 ❤⠀#숙소기록_국내#숙소기록_양양⠀⠀⠀#숙소 #숙소추천 #국내숙소 #여행 #여행지추천 #국내여행지추천 #국내여행 #여행스타그램 #커플여행 #가족여행 #감성숙소 #양양숙소 #양양숙소추천 #양양가볼만한곳 #양양여행 #양양감성숙소 #양양핫플 #양양핫플레이스 #양양펜션 #양양에어비앤비 #양양독채펜션 #양양펜션추천",2021-09-10,509,,"['#양양', '#팜11스테이', '#숙소기록', '#숙소기록_국내', '#숙소기록_양양⠀⠀⠀', '#숙소', '#숙소추천', '#국내숙소', '#여행', '#여행지추천', '#국내여행지추천', '#국내여행', '#여행스타그램', '#커플여행', '#가족여행', '#감성숙소', '#양양숙소', '#양양숙소추천', '#양양가볼만한곳', '#양양여행', '#양양감성숙소', '#양양핫플', '#양양핫플레이스', '#양양펜션', '#양양에어비앤비', '#양양독채펜션', '#양양펜션추천']",1631232000.0,https://scontent-ssn1-1.cdninstagram.com/v/t51.2885-15/fr/e15/p1080x1080/241665348_370186107930107_417354256850559046_n.jpg?_nc_ht=scontent-ssn1-1.cdninstagram.com&_nc_cat=111&_nc_ohc=66YW_4Zs5L0AX8K3kM9&edm=AP_V10EBAAAA&ccb=7-4&oh=59c794c69c1c8db7c371b84387ff6a00&oe=615A66D7&_nc_sid=4f375e
24,"⠀통창 너머 보이는 푸릇푸릇한 자연 🌿힐링 가득한 독채 펜션 #제주 #의귀소담 ✨⠀푸르른 자연 속 둘러쌓인 힐링 독채 펜션🌳통창 너머 보이는 나무와 하늘이너무나도 예쁜 숙소에요!⠀맛있는 바베큐도 즐기고무척 넓은 노천탕에서 피로도 싸악 풀리는 기분!⠀주위가 온통 감귤밭 뷰🍅인 친환경 숙소인데다가동백꽃으로 유명한 남원에 위치하기 떄문에겨울에 가시면 감귤이 주렁주렁 하니너무 예쁠 것 같아요!⠀📍주소서귀포시 남원읍 의귀리⠀🌿 숙소기록위치 : 고요한 제주 동네 골목 사이에 위치가격 : 비수기 기준 55~60만원특징 : 야외 노천탈, 바베 시설, 다도 공간, 감귤밭 피크닉 존 이용⠀📷사진 제공@hi_jin0_  님⠀⠀⠀⠀-⠀국내외 예쁜 숙소 정보는 #숙소기록 🌿숙소 제보는 DM 또는 이메일로 ❤⠀#숙소기록_국내#숙소기록_제주⠀⠀⠀#숙소 #숙소추천 #국내숙소 #여행 #여행지추천 #국내여행지추천 #국내여행 #여행스타그램 #커플여행 #제주여행 #감성숙소 #제주숙소 #제주숙소추천 #제주근교가볼만한곳 #제주여행 #제주감성숙소 #제주핫플 #제주핫플레이스 #제주에어비앤비 #제주독채펜션 #제주펜션 #노천탕숙소",2021-09-09,256,,"['#제주', '#의귀소담', '#숙소기록', '#숙소기록_국내', '#숙소기록_제주⠀⠀⠀', '#숙소', '#숙소추천', '#국내숙소', '#여행', '#여행지추천', '#국내여행지추천', '#국내여행', '#여행스타그램', '#커플여행', '#제주여행', '#감성숙소', '#제주숙소', '#제주숙소추천', '#제주근교가볼만한곳', '#제주여행', '#제주감성숙소', '#제주핫플', '#제주핫플레이스', '#제주에어비앤비', '#제주독채펜션', '#제주펜션', '#노천탕숙소']",1631145600.0,https://scontent-ssn1-1.cdninstagram.com/v/t51.2885-15/fr/e15/p1080x1080/241492394_171507235062694_2578473484534144292_n.jpg?_nc_ht=scontent-ssn1-1.cdninstagram.com&_nc_cat=110&_nc_ohc=YafOsjtdNi4AX_t_kNv&tn=XAC9zZAskNOLBakD&edm=AP_V10EBAAAA&ccb=7-4&oh=f744aa2b833c9c6ca634e8ef236b56ff&oe=615A942E&_nc_sid=4f375e
25,"⠀청량한 바람과 대나무숲이 있는 시골 속 아지트🌿🌳#미풍가⠀⠀숙소를 둘러싼 환경이 도시에 지친 삶을위로해주는 숙소에요~!!⠀⠀바스락거리는 나뭎잎 소리🍃연못에 흐르는 물소리,지저귀는 새소리🐦ASMR이 따로 필요없는 곳이에요✨✨⠀⠀공기좋은 동네에서마스크도 벗고 맑은 공기와 풀내음맡으며 힐링해보세요!!ㅎㅎ⠀⠀⠀📍 주소강원 양양군 현북면 검소길 74-11⠀💡 Tip🔸 입실 15:00~🔸 퇴실 11:00⠀⠀🌿 숙소기록가격 : 약 30만원대특징 : 에어비엔비,노키즈존,반려동물 동반 불가능, 인원제한 최대4인까지,편백나무욕조,취사불가⠀⠀-⠀⠀국내외 예쁜 숙소 정보는 #숙소기록 🌿숙소 제보는 DM 또는 이메일로 ❤⠀#숙소기록_국내#숙소기록_양양⠀#숙소 #숙소추천 #국내숙소 #여행 #여행지추천 #국내여행지추천 #국내여행 #여행스타그램 #커플여행 #가족여행 #감성숙소 #양양숙소 #양양숙소추천 #양양가볼만한곳 #양양여행 #양양감성숙소 #양양핫플 #양양핫플레이스 #양양독채펜션 #양양펜션 #에어비엔비숙소⠀⠀",2021-09-09,309,,"['#미풍가⠀⠀숙소를', '#숙소기록', '#숙소기록_국내', '#숙소기록_양양⠀', '#숙소', '#숙소추천', '#국내숙소', '#여행', '#여행지추천', '#국내여행지추천', '#국내여행', '#여행스타그램', '#커플여행', '#가족여행', '#감성숙소', '#양양숙소', '#양양숙소추천', '#양양가볼만한곳', '#양양여행', '#양양감성숙소', '#양양핫플', '#양양핫플레이스', '#양양독채펜션', '#양양펜션', '#에어비엔비숙소⠀⠀']",1631145600.0,https://scontent-ssn1-1.cdninstagram.com/v/t51.2885-15/fr/e15/s1080x1080/241513712_299793085282008_5337409302800921319_n.jpg?_nc_ht=scontent-ssn1-1.cdninstagram.com&_nc_cat=100&_nc_ohc=LPxIQvnOFFwAX8AnP-0&edm=AP_V10EBAAAA&ccb=7-4&oh=baf28975e7abd362fc20a51a1a6d4e9b&oe=615A90D2&_nc_sid=4f375e
26,계절을 느낄 수 있어서 보기만 해도 힐링이 되는#숲속뷰숙소모음 ✨⠀⠀-📍 #제주 #고요한오후 🌴제주특별자치도 서귀포시 안덕면 덕수동로 149-32⠀📍 #양양 #욜스테이 🏠강원도 양양군 손양면 동호리 55-4⠀📍 #제주 #춤추는달 🤍제주특별자치도 서귀포시 중문상로 230-6⠀📍 #전주 #모악산의아침 🏠전북 전주시 완산구 중인2길 25-48⠀📍 #횡성 #모모의다락방 🐬강원 횡성군 둔내면 경강로마암4길 49-1📍 #제주 #폴개우영 🌴제주특별자치도 서귀포시 남원읍 태위로894번길 13⠀-⠀국내외 예쁜 숙소 정보는 #숙소기록 🌿숙소 제보는 DM 또는 이메일로 ❤⠀#숙소기록_국내⠀⠀⠀#숙소 #숙소추천 #국내숙소 #여행지추천 #국내여행지추천 #국내여행 #여행스타그램 #감성숙소 #감성숙소추천 #제주숙소 #숲속숙소추천 #뷰좋은숙소추천,2021-09-08,"1,000",,"['#숲속뷰숙소모음', '#제주', '#고요한오후', '#양양', '#욜스테이', '#제주', '#춤추는달', '#전주', '#모악산의아침', '#횡성', '#모모의다락방', '#제주', '#폴개우영', '#숙소기록', '#숙소기록_국내⠀⠀⠀', '#숙소', '#숙소추천', '#국내숙소', '#여행지추천', '#국내여행지추천', '#국내여행', '#여행스타그램', '#감성숙소', '#감성숙소추천', '#제주숙소', '#숲속숙소추천', '#뷰좋은숙소추천']",1631059200.0,https://scontent-ssn1-1.cdninstagram.com/v/t51.2885-15/fr/e15/s1080x1080/241562219_256321863160281_5469761906119566511_n.jpg?_nc_ht=scontent-ssn1-1.cdninstagram.com&_nc_cat=109&_nc_ohc=1F-HBHr7paUAX9a5S3x&edm=AP_V10EBAAAA&ccb=7-4&oh=7fe684ce6b70897ad3cd4bdcf4995130&oe=615A5638&_nc_sid=4f375e
27,"⠀푸르른 장태산 휴양림 속에 자리잡고 있는노천탕 숙소#스테이인터뷰장태산 🌿✨⠀각 객실마다 대나무로 둘러쌓인프라이빗한 료칸이 있어요!⠀따뜻한 온기와 피톤치드 가득한 곳에서몸을 담그고 있으면 모든 피로가 쏴악한번에 풀리는 기분이에요 😉⠀숙소 바로 앞에는 메타세콰이어길과 게곡이 흐르고 있어자연뷰도 마음껏 감상할 수 있고 힐링 가득!⠀숙소에서 커피인터뷰도 함께 운영중이어서자연을 바라보며 오붓한 커피 한잔도 가능해요 ☕️⠀📍주소대전 서구 장안로 452⠀💡 Tip🔸 입실 15:00~🔸 퇴실 11:00⠀🌿 숙소기록위치 : 장태산 휴양림 속에 위치하고 있음가격 : 16~20만원대특징 : 객실마다 료칸과 바베큐 공간 마련, 어메니티 구비⠀⠀-⠀국내외 예쁜 숙소 정보는 #숙소기록 🌿숙소 제보는 DM 또는 이메일로 ❤⠀#숙소기록_국내#숙소기록_대전⠀⠀⠀#숙소 #숙소추천 #국내숙소 #여행 #여행지추천 #국내여행지추천 #국내여행 #여행스타그램 #커플여행 #가족여행 #감성숙소 #대전숙소 #대전숙소추천 #대전근교가볼만한곳 #대전여행 #대전감성숙소 #대전핫플 #대전핫플레이스 #대전에어비앤비 #대전독채펜션 #대전펜션 #대전근교숙소 #대전숙소 #노천탕숙소",2021-09-08,292,,"['#스테이인터뷰장태산', '#숙소기록', '#숙소기록_국내', '#숙소기록_대전⠀⠀⠀', '#숙소', '#숙소추천', '#국내숙소', '#여행', '#여행지추천', '#국내여행지추천', '#국내여행', '#여행스타그램', '#커플여행', '#가족여행', '#감성숙소', '#대전숙소', '#대전숙소추천', '#대전근교가볼만한곳', '#대전여행', '#대전감성숙소', '#대전핫플', '#대전핫플레이스', '#대전에어비앤비', '#대전독채펜션', '#대전펜션', '#대전근교숙소', '#대전숙소', '#노천탕숙소']",1631059200.0,https://scontent-ssn1-1.cdninstagram.com/v/t51.2885-15/fr/e15/p1080x1080/241482264_337593231391678_9159096258526009451_n.jpg?_nc_ht=scontent-ssn1-1.cdninstagram.com&_nc_cat=110&_nc_ohc=T4oofx8wWCEAX_RijBJ&edm=AP_V10EBAAAA&ccb=7-4&oh=891ca824fd6a036d47d3a221983f9deb&oe=615B29C9&_nc_sid=4f375e
28,올해 오픈한 신축 글램핑장💛#포천 #글램핑장 감성 가득한 카라반 글램핑장으로 숙소 내부에는 히노끼 욕조가 있어 마치 발리에 온 듯한 기분이 낭낭 😊 야외에 있는 수영장은 온수와 돔으로 되어있어사계절 이용이 가능해요! 캠장님의 감성적인 인테리어 소품과 신나게 뛰어놀 수 있는 잔디공원은 그야말로 포토존📷내부사진과 자세한 정보는@campingeasy.official  에서 확인하실 수 있습니다.🙇 @_kong2_ @glampark_camping 님의 소중한 사진제공 감사합니다.#포천글램핑 #글램핑장추천 #감성글램핑장,2021-09-08,343,,"['#포천', '#글램핑장', '#포천글램핑', '#글램핑장추천', '#감성글램핑장']",1631059200.0,https://scontent-ssn1-1.cdninstagram.com/v/t51.2885-15/fr/e15/s1080x1080/241434141_270553771354260_7424458792725523502_n.jpg?_nc_ht=scontent-ssn1-1.cdninstagram.com&_nc_cat=100&_nc_ohc=KIsUWJU96kEAX-Xysx5&edm=AP_V10EBAAAA&ccb=7-4&oh=8d35665c5028b79ec126008d9181c1bf&oe=615B01A8&_nc_sid=4f375e
29,"⠀힙하고 이국적인 느낌의 감성글램핑🤟🏻✨#제부도 #글램비글램핑⠀빈티지한 인테리어에 다양한 포토존이 있어사진찍기에도 좋고 바다와 아름다운 야경까지낭만이 가득한 글램핑장이에요!!⠀⠀바베큐도 하고 바다 앞 산책길따라산책도 좀 하고 불멍도 하면서캠핑 감성 만끽하고 오시는 거 추천★⠀⠀📍 주소경기 화성시 서신면 해안길 64⠀💡 Tip🔸 입실 15:00~🔸 퇴실 11:00⠀🌿 숙소기록위치 : 서울근교가격 : 약20-30만원대특징 : 깔끔한신축시설,전 객실 내부 화장실부스,포토존 완비,매점 운영풀패키지 바베큐무한리필+조식,호텔식 어메니티 제공(수건,치약,칫솔,폼클렌징, 비누,샴푸등)⠀⠀-⠀⠀국내외 예쁜 숙소 정보는 #숙소기록 🌿숙소 제보는 DM 또는 이메일로 ❤⠀#숙소기록_국내#숙소기록_제부도⠀#숙소 #숙소추천 #국내숙소 #여행 #여행지추천 #국내여행지추천 #국내여행 #여행스타그램 #커플여행 #가족여행 #감성숙소 #제부도숙소 #제부도숙소추천 #제부도가볼만한곳 #제부도여행 #제부도감성숙소 #제부도핫플 #제부도핫플레이스 #제부도독채펜션 #제부도펜션⠀",2021-09-07,487,,"['#제부도', '#글램비글램핑⠀빈티지한', '#숙소기록', '#숙소기록_국내', '#숙소기록_제부도⠀', '#숙소', '#숙소추천', '#국내숙소', '#여행', '#여행지추천', '#국내여행지추천', '#국내여행', '#여행스타그램', '#커플여행', '#가족여행', '#감성숙소', '#제부도숙소', '#제부도숙소추천', '#제부도가볼만한곳', '#제부도여행', '#제부도감성숙소', '#제부도핫플', '#제부도핫플레이스', '#제부도독채펜션', '#제부도펜션⠀']",1630972800.0,https://scontent-ssn1-1.cdninstagram.com/v/t51.2885-15/fr/e15/s1080x1080/241293367_1232531120520286_6283111395930705207_n.jpg?_nc_ht=scontent-ssn1-1.cdninstagram.com&_nc_cat=110&_nc_ohc=3vxuNc9JfnkAX85UUey&edm=AP_V10EBAAAA&ccb=7-4&oh=a03c201a7f35ed5f1340dd327b9866ba&oe=615A82FF&_nc_sid=4f375e
30,"⠀⠀지역별 노천탕 숙소모음✨✨@@가을에 자기랑 갈 곳 미리 메모,,,끄적X2⠀⠀-⠀⠀국내외 예쁜 숙소 정보는 #숙소기록 🌿숙소 제보는 DM 또는 이메일로 ❤⠀#숙소기록_국내⠀⠀⠀#숙소 #숙소추천 #국내숙소 #여행지추천 #국내여행지추천 #국내여행 #여행스타그램 #감성숙소 #노천탕숙소추천 #노천탕숙소 #노천탕추천 #강릉여행 #제주여행 #울산여행 #부산여행⠀",2021-09-06,251,,"['#숙소기록', '#숙소기록_국내⠀⠀⠀', '#숙소', '#숙소추천', '#국내숙소', '#여행지추천', '#국내여행지추천', '#국내여행', '#여행스타그램', '#감성숙소', '#노천탕숙소추천', '#노천탕숙소', '#노천탕추천', '#강릉여행', '#제주여행', '#울산여행', '#부산여행⠀']",1630886400.0,https://scontent-ssn1-1.cdninstagram.com/v/t51.2885-15/fr/e15/s1080x1080/241289917_2154931467979356_8404105044726481237_n.jpg?_nc_ht=scontent-ssn1-1.cdninstagram.com&_nc_cat=100&_nc_ohc=51VGjipUJKMAX9tAkSY&edm=AP_V10EBAAAA&ccb=7-4&oh=9f68d1efe652bee2872132cd08303cb1&oe=615A6190&_nc_sid=4f375e
31,"그림같은 일몰과 다채로운 자연의 색깔을 즐길 수 있는 곳이것이야말로 가을 힐링✨ #서산 #제로플레이스 황락호수에 풀어놓은 짙은 물감물가에 비추는 푸른 산맥산 너머로 물드는 붉은 하늘이곳은 바로 제로플레이스 입니다🏠편안한 휴식처가 되어줄가을뷰🍁 그리고 피로를 씻어줄 스파까지🌊저수지를 따라 산책로가 잘 되어 있어자연을 만끽할 수 있어요!아침에는 침대에 누워 가을을 입은 산과 호수를 바라보고저녁엔 스파와 함께 일몰을 구경하면 완벽한 힐링 그 자체!📍 주소충청남도 서산시 해미면 황락리 13-2⠀💡 Tip🔸 입실 16:00~🔸 퇴실 12:00🔸 카페테리아에서 조식 가능 (오전10시~11시)⠀🌿 숙소기록위치 : 자차 12분거리에 마트,시장,편의점 있음.가격 : 18만원부터~특징 : 사진속 숙소는 +02, +03 방입니다!-⠀국내외 예쁜 숙소 정보는 #숙소기록 🌿숙소 제보는 DM 또는 이메일로 ❤⠀#숙소기록_국내#숙소기록_서산⠀⠀⠀#숙소 #숙소추천 #국내숙소 #여행 #여행지추천 #국내여행지추천 #국내여행 #여행스타그램 #커플여행 #가족여행 #감성숙소 #서산숙소 #서산숙소추천 #서산가볼만한곳 #충남여행 #서산여행 #서산감성숙소 #서산핫플 #서산핫플레이스 #서산에어비앤비 #서산펜션 #충남펜션 #레이크뷰 #호수뷰숙소",2021-09-06,269,,"['#서산', '#제로플레이스', '#숙소기록', '#숙소기록_국내', '#숙소기록_서산⠀⠀⠀', '#숙소', '#숙소추천', '#국내숙소', '#여행', '#여행지추천', '#국내여행지추천', '#국내여행', '#여행스타그램', '#커플여행', '#가족여행', '#감성숙소', '#서산숙소', '#서산숙소추천', '#서산가볼만한곳', '#충남여행', '#서산여행', '#서산감성숙소', '#서산핫플', '#서산핫플레이스', '#서산에어비앤비', '#서산펜션', '#충남펜션', '#레이크뷰', '#호수뷰숙소']",1630886400.0,https://scontent-ssn1-1.cdninstagram.com/v/t51.2885-15/fr/e15/p1080x1080/241371032_154399623512846_8542960391146132631_n.jpg?_nc_ht=scontent-ssn1-1.cdninstagram.com&_nc_cat=102&_nc_ohc=UtV6786NWXoAX_a24NW&edm=AP_V10EBAAAA&ccb=7-4&oh=29449450f54655b37719454d5884ab43&oe=615BF803&_nc_sid=4f375e
32,"⠀시골집에 온 듯 편안한 분위기에서노천탕을 즐길 수 있는 #청도 #루오스테이 🛁⠀대구 근교에서 노천탕을 즐기고 싶을 때묵기 좋은 곳!⠀친숙하고 따듯한 분위기에넓은 내부까지, 푹 쉬다 가기 최적의 조건이에요🌿⠀안쪽까지 초록초록 자연이 가득하게꾸며져 있어서 얼핏 제주도에 온 듯한 기분도낼 수 있답니다:)⠀📍주소경상북도 청도군 이서면 중리길 37-6⠀💡 Tip🔸 입실 15:00~🔸 퇴실 11:00⠀🌿 숙소기록어메니티 : 간단한 조미료부터 불멍용 장작까지!편하게 다녀올 수 있도록 갖춰져 있음가격 : 평일 40-45만원, 금/토/공휴일 전날 50-55 (방 별로 차이있음)특징 : 독채, 노천탕,넷플릭스 가능⠀⠀⠀-⠀국내외 예쁜 숙소 정보는 #숙소기록 🌿숙소 제보는 DM 또는 이메일로 ❤⠀#숙소기록_국내#숙소기록_대구⠀⠀⠀#숙소 #숙소추천 #국내숙소 #여행 #여행지추천 #국내여행지추천 #국내여행 #여행스타그램 #커플여행 #가족여행 #감성숙소 #대구숙소 #대구숙소추천 #대구근교가볼만한곳 #청도여행 #대구감성숙소 #대구핫플 #대구핫플레이스 #대구에어비앤비 #대구독채펜션 #대구펜션 #대구근교숙소 #청도숙소 #노천탕숙소",2021-09-06,"1,922",경북 청도,"['#청도', '#루오스테이', '#숙소기록', '#숙소기록_국내', '#숙소기록_대구⠀⠀⠀', '#숙소', '#숙소추천', '#국내숙소', '#여행', '#여행지추천', '#국내여행지추천', '#국내여행', '#여행스타그램', '#커플여행', '#가족여행', '#감성숙소', '#대구숙소', '#대구숙소추천', '#대구근교가볼만한곳', '#청도여행', '#대구감성숙소', '#대구핫플', '#대구핫플레이스', '#대구에어비앤비', '#대구독채펜션', '#대구펜션', '#대구근교숙소', '#청도숙소', '#노천탕숙소']",1630886400.0,https://scontent-ssn1-1.cdninstagram.com/v/t51.2885-15/e15/241405978_402986357851951_2689684239780179358_n.jpg?_nc_ht=scontent-ssn1-1.cdninstagram.com&_nc_cat=107&_nc_ohc=M-gdt5dFsyQAX9zLafL&edm=AP_V10EBAAAA&ccb=7-4&oh=21b66019cee78f3064c834b1c5b3788d&oe=615ABB77&_nc_sid=4f375e
33,"⠀한적하고 조용하게 쉬어가며 힐링할 수있는 #그루브스테이✨✨⠀예쁜 숙소에서 조용히 쉬어가며재충전하고 싶으신분들께 강추드리는 숙소에요💚⠀⠀아름다운 숲뷰를 감상하며 노천탕♨️을 즐길 수있어쌓인 피로를 풀어줄 수있는 매력적인 곳이에요!!⠀⠀친구와 또는 연인과 함께 낭만을 즐기면서특별한 시간을 보내보세요!👩‍❤️‍💋‍👩👨‍❤️‍💋‍👨👩‍❤️‍💋‍👨⠀📍주소부산 기장군 기장읍 당사로5길 17⠀💡 Tip🔸 입실 16:00~🔸 퇴실 11:00⠀🌿 숙소기록위치 : 근처 6분거리 대형마트 있음가격 : 약 20-25만원대특징 : 온돌난방, 장작스토브, 개별테라스 등⠀⠀⠀-⠀국내외 예쁜 숙소 정보는 #숙소기록 🌿숙소 제보는 DM 또는 이메일로 ❤⠀#숙소기록_국내#숙소기록_부산⠀⠀⠀#숙소 #숙소추천 #국내숙소 #여행 #여행지추천 #국내여행지추천 #국내여행 #여행스타그램 #커플여행 #가족여행 #감성숙소 #부산숙소 #부산숙소추천 #부산가볼만한곳 #부산여행 #부산감성숙소 #부산핫플 #부산핫플레이스 #부산에어비앤비 #부산독채펜션 #부산펜션⠀⠀⠀",2021-09-03,356,,"['#그루브스테이✨✨⠀예쁜', '#숙소기록', '#숙소기록_국내', '#숙소기록_부산⠀⠀⠀', '#숙소', '#숙소추천', '#국내숙소', '#여행', '#여행지추천', '#국내여행지추천', '#국내여행', '#여행스타그램', '#커플여행', '#가족여행', '#감성숙소', '#부산숙소', '#부산숙소추천', '#부산가볼만한곳', '#부산여행', '#부산감성숙소', '#부산핫플', '#부산핫플레이스', '#부산에어비앤비', '#부산독채펜션', '#부산펜션⠀⠀⠀']",1630627200.0,https://scontent-ssn1-1.cdninstagram.com/v/t51.2885-15/fr/e15/s1080x1080/241025614_3085343695033578_5896683131274577027_n.jpg?_nc_ht=scontent-ssn1-1.cdninstagram.com&_nc_cat=106&_nc_ohc=v8DrJMeJBJUAX-Xp7ST&edm=AP_V10EBAAAA&ccb=7-4&oh=f451f7812ea9a4a6777cdbe1203101fb&oe=615BB7E3&_nc_sid=4f375e
34,"높은 가을하늘 바라보며 힐링할 수 있는💙#노천탕숙소 모음 💙-📍 #강릉 #목가블루목조한옥 가운데 고요한 정원,그리고 노천탕 🌊⠀📍 #남해 #적정온도노을이 제일 맛있는 집,침대 위에서도 즐기는 노을🏠⠀📍 #전주 #다가도원프라이빗한 한옥 노천탕캠핑세트까지 즐기는 한옥스테이 🤍⠀📍 #파주 #요나루키서울 근교에서 제일 핫한노천탕 맛집 🏠⠀📍 #제주 #씨에스호텔시크릿가든 촬영지리얼 제주를 느끼고 싶다면 여기로!⠀📍 #하동 #켄싱턴리조트녹차밭 초록 뷰와 함께 하는 힐링 노천탕모던한 히노끼탕 숙소🐬⠀-⠀국내외 예쁜 숙소 정보는 #숙소기록 🌿숙소 제보는 DM 또는 이메일로 ❤⠀#숙소기록_국내⠀⠀⠀#숙소 #숙소추천 #국내숙소 #여행지추천 #국내여행지추천 #국내여행 #여행스타그램 #감성숙소 #노천탕숙소추천 #노천탕숙소 #노천탕추천 #강릉여행 #제주여행 #전주여행 #남해여행",2021-09-02,328,,"['#노천탕숙소', '#강릉', '#목가블루목조한옥', '#남해', '#적정온도노을이', '#전주', '#다가도원프라이빗한', '#파주', '#요나루키서울', '#제주', '#씨에스호텔시크릿가든', '#하동', '#켄싱턴리조트녹차밭', '#숙소기록', '#숙소기록_국내⠀⠀⠀', '#숙소', '#숙소추천', '#국내숙소', '#여행지추천', '#국내여행지추천', '#국내여행', '#여행스타그램', '#감성숙소', '#노천탕숙소추천', '#노천탕숙소', '#노천탕추천', '#강릉여행', '#제주여행', '#전주여행', '#남해여행']",1630540800.0,https://scontent-ssn1-1.cdninstagram.com/v/t51.2885-15/fr/e15/p1080x1080/241107419_522536248842741_2880217648634695881_n.jpg?_nc_ht=scontent-ssn1-1.cdninstagram.com&_nc_cat=109&_nc_ohc=TVh7WAhoqn4AX80oX7d&edm=AP_V10EBAAAA&ccb=7-4&oh=b41b39450590c508930a1ad2fc05ca1e&oe=615BC8FF&_nc_sid=4f375e
35,"서해바다의 아름다은 일몰 맛집 캠핑장🏕#태안 #사목공원캠핑장 캠핑장 대부분의 사이트에서 뻥 뚫린 바다뷰를 볼 수 있는 태안사목공원캠핑장💕뷰는 물론 편의시설도 깔끔하게 관리되고 있어 캠퍼들에게 평이 좋은 곳이에요! 캠핑장 이용객 외에는 입장하기 힘든 바다가 있어 프라이빗하게 즐기고 올 수 있어요😄 물이 빠지면 조개잡기 체험이 가능하며지는 석양을 보며 바다를 따라 걸으면 이게 바로 찐 행복 :) TIP입촌 13:00퇴촌 12:00 특징 : 반려동물o, 모래바람 주의! 가격 : 4.5~5.5더 많은 캠핑정보는 @campingeasy.official 에서 확인 📷 @_162.8_sy, @nill_camp, @syoung_jang 님의 소중한 사진 제공 감사합니다.　　#태안사목공원캠핑장 #충남캠핑장 #태안캠핑장 #숙소기록",2021-09-01,415,,"['#태안', '#사목공원캠핑장', '#태안사목공원캠핑장', '#충남캠핑장', '#태안캠핑장', '#숙소기록']",1630454400.0,https://scontent-ssn1-1.cdninstagram.com/v/t51.2885-15/fr/e15/s1080x1080/241026769_1504092379965969_3456205430133365943_n.jpg?_nc_ht=scontent-ssn1-1.cdninstagram.com&_nc_cat=109&_nc_ohc=vdCDYrJAr3wAX9lF07O&tn=XAC9zZAskNOLBakD&edm=AP_V10EBAAAA&ccb=7-4&oh=13c49a39803d40d0f88f07afbb525e11&oe=615AE8BC&_nc_sid=4f375e
