,content,date,like,place,tags,unix,imgUrl
23,"#완주 #느린집 반려견동반이 가능한 완주 숙소, 느린집입니다.느린집은 완주의 어느 시골마을에 위치한 독채숙소입니다. 바베큐 파티를 할 수 있는 평상과 욕조가 있는 앞마당이 포인트입니다. 반려견과 함께 앞마당에서 야외활동을 즐겨보시길 바래요. (실내입장시 반려견의 발을 깨끗이 닦아주세요!) 돌담과 나무가 보이는 침실은 이곳의 메인 포토존이랍니다. 하얀 커튼을 걷고 반려견과 사진을 남겨보시길 바래요. 파티룸 분위기로 꾸며진 다이닝룸에서 일행과 소소한 파티를 열어보는 것도 좋은 추억을 쌓는 데에 도움이 될 거예요 ₍•͈ᴗ•͈₎🪄이런 분들에게 추천해드려요✧#반려견동반펜션 을 찾는 분✧#파티룸 같은 다이닝룸에서 소소하게 파티를 열고 싶은 분__ __ __ __ __ __ __ __ __ __ __ __ 주소: 전라북도 완주군 상관면체크인: 15:00 / 체크아웃: 10:00가격:  200,000~숙소인스타: @slow__house __ __ __ __ __ __ __ __ __ __ __ __ 💡여행지보다 숙소를 먼저 고르는 에디터가 추천해주는#숙소하다_완주 #숙소하다_전라북도˳˳사진 출처: @corn_luv @eunbabi_ @kyeongyeon_u @sunny.lounge_ #완주여행 #완주숙소 #완주펜션 #애견동반펜션 #반려견동반숙소 #전주근교나들이 #전주근교여행 #전주숙소추천 #독채펜션추천 #촌캉스 #숙소추천 #감성숙소 #에어비앤비추천",2021-09-04,22,완주군,"['#완주', '#느린집', '#반려견동반펜션', '#파티룸', '#숙소하다_완주', '#숙소하다_전라북도˳˳사진', '#완주여행', '#완주숙소', '#완주펜션', '#애견동반펜션', '#반려견동반숙소', '#전주근교나들이', '#전주근교여행', '#전주숙소추천', '#독채펜션추천', '#촌캉스', '#숙소추천', '#감성숙소', '#에어비앤비추천']",1630713600.0,https://scontent-ssn1-1.cdninstagram.com/v/t51.2885-15/e35/p1080x1080/241113423_201192888665154_5182778467334967962_n.jpg?_nc_ht=scontent-ssn1-1.cdninstagram.com&_nc_cat=106&_nc_ohc=MvZHYUQeJvYAX9ofqTc&edm=AP_V10EBAAAA&ccb=7-4&oh=871ae5d5c72ed41fa2779476a8ec89f3&oe=6162BE4E&_nc_sid=4f375e
24,"#제천 #리솜포레스트 자연과 교감하며 일상의 피로를 회복할 수 있는 곳, 제천에 위치한 리솜포레스트입니다. 리솜포레스트는 자연지형과 식생을 그대로 보존하는 형태로 설계되어 자연 속에서 피톤치드를 마시며 휴식을 취할 수 있는 곳입니다. 다양한 스파존을 보유하고 있는 것이 특징인데요! 숲을 바라보며 수영을 즐길 수 있는 인피니티스파존과 커다란 돌을 깎아 속을 파내 만든 프라이빗 스톤스파가 가장 인기있는 시설입니다. 스톤스파는 2인이하 입장을 권장하며 웨이팅이 있을시 15분 사용 가능하다고 해요 :) 뜨끈뜨끈하게 스파를 즐기며 특별한 인생샷을 찍어보시길 바랍니다 ᜊ( ' ⩊ ')ᜊ🪄이런 분들에게 추천해드려요✧#숲뷰 숙소를 찾는 분✧#프라이빗스파 를 즐기고 싶은 분__ __ __ __ __ __ __ __ __ __ __ __ 주소: 충북 제천시 백운면 금봉로 365체크인: 15:00 / 체크아웃: 11:00가격: 약 300,000~ 숙소인스타: @resom.resort __ __ __ __ __ __ __ __ __ __ __ __ 💡여행지보다 숙소를 먼저 고르는 에디터가 추천해주는#숙소하다_제천 #숙소하다_충청북도˳˳사진 출처: @uji.sunny @yang._.z @__say_hee @_riming_ @_yedal_ #제천여행 #제천리솜포레스트 #제천숙소 #리솜포레스트제천 #포레스트리솜 #제천리조트 #헤브나인스파 #리조트추천 #힐링숙소 #마운틴뷰숙소 #숙소추천",2021-09-03,49,리솜 포레스트 Resom Forest,"['#제천', '#리솜포레스트', '#숲뷰', '#프라이빗스파', '#숙소하다_제천', '#숙소하다_충청북도˳˳사진', '#제천여행', '#제천리솜포레스트', '#제천숙소', '#리솜포레스트제천', '#포레스트리솜', '#제천리조트', '#헤브나인스파', '#리조트추천', '#힐링숙소', '#마운틴뷰숙소', '#숙소추천']",1630627200.0,https://scontent-ssn1-1.cdninstagram.com/v/t51.2885-15/e35/241278114_386900973014957_3842422742344378098_n.jpg?_nc_ht=scontent-ssn1-1.cdninstagram.com&_nc_cat=105&_nc_ohc=uEDyVaqzPHsAX9hwLUn&edm=AP_V10EBAAAA&ccb=7-4&oh=0798d40f8e7859cbce74c66ce0035622&oe=61631862&_nc_sid=4f375e
25,"#양산 #스테이무메 휴식하며 오순도순 이야기하기 좋은 부산근교 양산에 위치한 숙소, 스테이무메입니다.스테이무메는 복층으로 이루어져 있습니다. 1층엔 티비, 소파대신 도란도란 이야기 나눌 수 있는 널찍한 다이닝룸이 마련되어 있답니다. 욕실에는 대형 욕조가 있다고 해요. 미리 신청하면 입욕제가 제공된다고 하니 입욕제와 함께 반신욕을 즐겨보시길 바래요 :) 2층엔 숲뷰를 감상할 수 있는 침실이 마련되어 있습니다. 자연을 가까이 두며 포근한 하루를 보내보세요 ! *냉장고 안에는 호스트가 준비한 웰컴푸드가 있으니 출출하실 때 웰컴푸드로 배를 채워보세요 (๑′ᴗ‵๑)🪄이런 분들에게 추천해드려요✧#부산근교여행 을 떠나시는 분✧#양산숙소 를 찾는 분__ __ __ __ __ __ __ __ __ __ __ __ 주소: 경남 양산시 원동면 원동로 2084체크인: 15:30 / 체크아웃: 11:00가격: 450,000~숙소인스타: @stay_mume__ __ __ __ __ __ __ __ __ __ __ __ 💡여행지보다 숙소를 먼저 고르는 에디터가 추천해주는#숙소하다_양산 #숙소하다_경상남도˳˳사진 출처: @delight_2.0 @ohamoooo @dal__soap #부산근교드라이브 #부산근교나들이 #양산여행 #양산핫플 #양산가볼만한곳 #양산숙소추천 #에어비앤비추천 #부산에어비앤비 #에어비앤비부산",2021-09-02,31,양산,"['#양산', '#스테이무메', '#부산근교여행', '#양산숙소', '#숙소하다_양산', '#숙소하다_경상남도˳˳사진', '#부산근교드라이브', '#부산근교나들이', '#양산여행', '#양산핫플', '#양산가볼만한곳', '#양산숙소추천', '#에어비앤비추천', '#부산에어비앤비', '#에어비앤비부산']",1630540800.0,https://scontent-ssn1-1.cdninstagram.com/v/t51.2885-15/e35/241138357_551549952658831_2311554449967739764_n.jpg?_nc_ht=scontent-ssn1-1.cdninstagram.com&_nc_cat=107&_nc_ohc=-Jxm2gdlgzIAX8cQ9Ay&edm=AP_V10EBAAAA&ccb=7-4&oh=12f82455573be2c06b18f78e52661cf5&oe=61626039&_nc_sid=4f375e
26,"#홍천 #올라운드원 자연과 어우러져 있는 홍천의 원형 독채펜션, 올라운드원입니다. 올라운드원은 1라운드부터 8라운드까지 총 8개의 객실로 이루어진 독채펜션입니다. 원형 모양으로 띄엄띄엄 위치해있어 프라이빗하게 즐길 수 있답니다 :) 실내 or 야외 자쿠지로 나눠져있는데요! 날씨 계절과 상관없이 즐기고싶다면 실내 자쿠지가 있는 룸으로 예약해주시길 바래요. 미니 정원을 바라보며 힐링할 수 있답니다. 마당에서 푸릇푸릇한 자연을 배경삼아 인생샷까지 찍어보시길 바랍니다…⋆🪄이런 분들에게 추천해드려요✧#홍천독채펜션 을 찾는 분✧자연 속에서 머물 수 있는 #홍천숙소 를 찾는 분__ __ __ __ __ __ __ __ __ __ __ __ 주소: 강원 홍천군 서면 굴업솔골길 117체크인: 15:30 / 체크아웃: 11:00가격: 150,000~숙소인스타: @allroundone __ __ __ __ __ __ __ __ __ __ __ __ 💡여행지보다 숙소를 먼저 고르는 에디터가 추천해주는#숙소하다_홍천 #숙소하다_강원도˳˳사진 출처: @iam.hyemin @soji__ni @__wheniwasyoung @nhyelune_ #강원도여행 #홍천여행 #홍천펜션 #홍천펜션추천 #강원도펜션추천 #강원도독채펜션 #홍천숙소추천 #히노끼탕펜션 #자쿠지펜션",2021-09-01,28,올라운드원,"['#홍천', '#올라운드원', '#홍천독채펜션', '#홍천숙소', '#숙소하다_홍천', '#숙소하다_강원도˳˳사진', '#강원도여행', '#홍천여행', '#홍천펜션', '#홍천펜션추천', '#강원도펜션추천', '#강원도독채펜션', '#홍천숙소추천', '#히노끼탕펜션', '#자쿠지펜션']",1630454400.0,https://scontent-ssn1-1.cdninstagram.com/v/t51.2885-15/e35/240939847_1194629524391917_4221444965581446979_n.jpg?_nc_ht=scontent-ssn1-1.cdninstagram.com&_nc_cat=101&_nc_ohc=P0SSjHtmSqgAX_I_p4a&tn=Ont8o1D8KKnPYM0B&edm=AP_V10EBAAAA&ccb=7-4&oh=6247267fc308b5b923581281c789d8af&oe=61625DB1&_nc_sid=4f375e
27,"#경주 #더케이호텔경주 황룡원뷰를 볼 수 있는 경주 숙소, 더케이호텔경주입니다. 더케이호텔경주는 보문단지에 위치해있어 첨성대, 불국사 등 문화유산 유적지와 인접해있다고 해요. 경주에서 접근성 좋은 숙소를 찾는다면 이곳이 딱이겠죠? :)객실 전망은 로드뷰와 마운틴뷰로 나눠져 있습니다. 황룡원뷰를 보고싶다면 반드시 로드뷰로 예약해주셔야 합니다! 높은 층수일수록 더 잘 보인다고 하니 참고해주세요. 경주의 감성이 물씬 느껴지는 더케이호텔경주에서 이색적인 뷰를 맘껏 즐겨보시길 바랍니다🪄이런 분들에게 추천해드려요✧접근성좋은 #경주숙소 를 찾는 분✧이색적인 #뷰맛집숙소 를 찾는 분__ __ __ __ __ __ __ __ __ __ __ __ 주소: 경북 경주시 엑스포로 45체크인: 15:00 / 체크아웃: 11:00숙소인스타: @thek_hotel_gyeongju __ __ __ __ __ __ __ __ __ __ __ __ 💡여행지보다 숙소를 먼저 고르는 에디터가 추천해주는#숙소하다_경주 #숙소하다_경상북도˳˳사진 출처: @98.myo @su_yeony82 @eunjung0950599 @hyunii_yuun #경주여행 #경주가볼만한곳 #경주숙소추천 #경주숙박 #경주호텔 #경주호캉스 #황룡원 #경주감성숙소 #숙소추천 #감성숙소",2021-08-30,26,경주 the K Hotel,"['#경주', '#더케이호텔경주', '#경주숙소', '#뷰맛집숙소', '#숙소하다_경주', '#숙소하다_경상북도˳˳사진', '#경주여행', '#경주가볼만한곳', '#경주숙소추천', '#경주숙박', '#경주호텔', '#경주호캉스', '#황룡원', '#경주감성숙소', '#숙소추천', '#감성숙소']",1630281600.0,https://scontent-ssn1-1.cdninstagram.com/v/t51.2885-15/e35/240930336_121351083575805_2073464996961260292_n.jpg?_nc_ht=scontent-ssn1-1.cdninstagram.com&_nc_cat=109&_nc_ohc=4EfeS2Hm7RoAX_A87md&edm=AP_V10EBAAAA&ccb=7-4&oh=232ad9d3718efc13323745e1190d123f&oe=61626B28&_nc_sid=4f375e
28,"#서촌 #뉠스테이 도심 속에서 편안히 쉴 수 있는 서촌의 한옥숙소, 뉠스테이입니다. 뉠스테이는 특이하게도 지상과 지하로 이루어진 복층 한옥스테이입니다. 지상에서 아담한 마당을 접하고 있는 창은 모두 통유리로 되어있다고 합니다. 객실 내부에서 따뜻한 차 한 잔을 즐기며 운치 있는 풍경을 즐겨보세요 :) 지하엔 비밀스러운 아지트같은 느낌의 미디어룸이 있습니다. 큰 스크린으로 넷플릭스, 왓챠, 유튜브의 미디어를 볼 수 있다고 하니 도란도란 이야기를 나누며 영화 한 편 감상해보시길 바랍니다 🤍🪄이런 분들에게 추천해드려요✧도심 속 #힐링숙소 를 찾는 분✧영화감상이 가능한 #한옥스테이 를 찾는 분__ __ __ __ __ __ __ __ __ __ __ __ 주소: 서울 종로구 필운대로5길 17 뉠스테이체크인: 16:00 / 체크아웃: 11:00숙소문의: @nuilestay __ __ __ __ __ __ __ __ __ __ __ __ 💡여행지보다 숙소를 먼저 고르는 에디터가 추천해주는#숙소하다_서울˳˳사진 출처: @a_anvly @e_mini23 @mandu__u #서울여행 #서울숙소 #서울숙소추천 #서울에어비앤비 #에어비앤비서울 #서촌숙소 #서울감성숙소 #서울한옥스테이 #한옥숙소 #숙소추천",2021-08-29,26,뉠스테이,"['#서촌', '#뉠스테이', '#힐링숙소', '#한옥스테이', '#숙소하다_서울˳˳사진', '#서울여행', '#서울숙소', '#서울숙소추천', '#서울에어비앤비', '#에어비앤비서울', '#서촌숙소', '#서울감성숙소', '#서울한옥스테이', '#한옥숙소', '#숙소추천']",1630195200.0,https://scontent-ssn1-1.cdninstagram.com/v/t51.2885-15/e35/240731809_4355011704615686_323052766149338310_n.jpg?_nc_ht=scontent-ssn1-1.cdninstagram.com&_nc_cat=102&_nc_ohc=6hFarVlKQx4AX9ppfwZ&tn=Ont8o1D8KKnPYM0B&edm=AP_V10EBAAAA&ccb=7-4&oh=90a1650098da99489323e36d5abc5691&oe=6162B8F6&_nc_sid=4f375e
29,"#부여 #현암리돌담집 옛집을 리모델링한 부여의 리틀포레스트 숙소, 현암리돌담집입니다.현암리돌담집은 오래된 한옥고택을 리모델링해서 만들어진 감성숙소입니다. 이곳은 사방이 밤나무산으로 둘러싸여 있어 산골의 정취를 마음껏 만끽할 수 있답니다. 자연 속, 시골에서 고요하게 머물다 가시고 싶은 분들께 추천해드려요:) 감나무와 각종 야생화가 피어나는 아름다운 정원에서 인생샷을 찍어보셔도 좋을 것 같아요. 초록빛을 가득 머금은 뷰를 보며 몸과 마음을 힐링해보세요 ๑🪄이런 분들에게 추천해드려요✧#리틀포레스트 감성의 숙소를 찾는 분✧#시골감성 이 가득한 곳에서 머물고 싶은 분__ __ __ __ __ __ __ __ __ __ __ __ 주소: 충남 부여군 구룡면 망해로295번길 25-18체크인: 15:00 / 체크아웃: 11:00숙소인스타: @th.mandlgo __ __ __ __ __ __ __ __ __ __ __ __ 💡여행지보다 숙소를 먼저 고르는 에디터가 추천해주는#숙소하다_부여 #숙소하다_충청남도˳˳사진 출처: @minnnnk__ @minzzu_s2 @lava.uu @mayrose_sseon @yejin.gloria #부여여행 #부여가볼만한곳 #부여숙소 #부여숙소추천 #에어비앤비추천 #힐링숙소 #뷰맛집숙소 #감성숙소 #숙소추천 #충남숙소 #충남여행",2021-08-28,32,부여군,"['#부여', '#현암리돌담집', '#리틀포레스트', '#시골감성', '#숙소하다_부여', '#숙소하다_충청남도˳˳사진', '#부여여행', '#부여가볼만한곳', '#부여숙소', '#부여숙소추천', '#에어비앤비추천', '#힐링숙소', '#뷰맛집숙소', '#감성숙소', '#숙소추천', '#충남숙소', '#충남여행']",1630108800.0,https://scontent-ssn1-1.cdninstagram.com/v/t51.2885-15/e35/240635360_610726183251409_1549222389751966284_n.jpg?_nc_ht=scontent-ssn1-1.cdninstagram.com&_nc_cat=101&_nc_ohc=EtNP_wojja4AX_sGMKq&edm=AP_V10EBAAAA&ccb=7-4&oh=4f54137fc6ad0da8feb1404f151d5574&oe=6163460A&_nc_sid=4f375e
30,"#부산 #nnnn 부산 전포동의 위치한 감성숙소, nnnn입니다.nnnn은 아늑하고 따뜻한 분위기가 주를 이루는 숙소입니다. 들어서자마자 주방이 보이고, 하얀 커튼을 열면 푹신한 침대를 만날 수 있습니다. 침대 옆에는 차를 마실 수 있는 공간이 마련되어 있어 여유롭게 한 잔 즐기시면 좋을 것 같아요. 가파른 계단을 따라 올라가면 이곳의 하이라이트인 타자기를 칠 수 있는 공간과 LP판으로 음악을 들을 수 있는 공간이 마련되어 있답니다. 음악을 들으며 타자기로 그 날의 일기를 써보시길 바래요 :) 빈티지한 감성이 가득한 숙소를 좋아하시는 분들께 안성맞춤이랍니다 ✧*⁎🪄이런 분들에게 추천해드려요✧#아날로그감성 이 가득한 숙소를 찾는 분✧#부산감성숙소 를 찾는 분__ __ __ __ __ __ __ __ __ __ __ __ 주소: 부산 전포동 (예약 후 안내)체크인: 16:00 / 체크아웃: 11:00숙소문의: @nnnn_busan __ __ __ __ __ __ __ __ __ __ __ __ 💡여행지보다 숙소를 먼저 고르는 에디터가 추천해주는#숙소하다_부산˳˳사진 출처:  @s_13248619 @030bbbbb @tmxxnjs @yualize @_eivom_ #부산여행 #부산숙소 #부산숙소추천 #전포동숙소 #서면숙소 #부산에어비앤비 #에어비앤비부산 #에어비앤비추천 #감성숙소 #nnnn부산",2021-08-27,22,부산,"['#부산', '#nnnn', '#아날로그감성', '#부산감성숙소', '#숙소하다_부산˳˳사진', '#부산여행', '#부산숙소', '#부산숙소추천', '#전포동숙소', '#서면숙소', '#부산에어비앤비', '#에어비앤비부산', '#에어비앤비추천', '#감성숙소', '#nnnn부산']",1630022400.0,https://scontent-ssn1-1.cdninstagram.com/v/t51.2885-15/e35/240675998_961264384449062_6267072783666885600_n.jpg?_nc_ht=scontent-ssn1-1.cdninstagram.com&_nc_cat=102&_nc_ohc=mwOvhHbugioAX_Oe__y&edm=AP_V10EBAAAA&ccb=7-4&oh=969b9224f9fce62638961aadfab02c3e&oe=6162A2CA&_nc_sid=4f375e
31,"#완주 #소양고택 카페와 책방까지 함께 운영되는 완주의 고즈넉한 한옥스테이, 소양고택입니다.소양고택은 산을 바라보는 곳에 위치해있어 마운틴뷰를 원없이 즐길 수 있는 곳입니다. 플리커책방과 두베카페도 숙소와 함께 운영되고  있는데요 ! 책방에선 한적하게 책을 읽을 수 있고, 카페에선 웰컴드링크와 조식을 드실 수 있다고 해요. 조식은 누룽지와 전라도 한식차림으로 제공되며, 후식까지 드실 수 있다고 합니다. 아침에 일찍 오셔서 창가 자리 쪽에서 즐겨보시길 바래요! 고즈넉한 이곳에서 하루동안 별과 달, 자연을 감상하고 풀벌레 소리를 들으며 여유로운 추억을 남겨보시길 바랍니다 ෆ•̀ᴗ•́ෆ🪄이런 분들에게 추천해드려요✧고즈넉한 #한옥스테이 를 찾는 분✧자연 속에서 머물 수 있는 #힐링숙소 를 찾는 분__ __ __ __ __ __ __ __ __ __ __ __ 주소: 전북 완주군 소양면 송광수만로 472-23체크인: 16:30 / 체크아웃: 10:30숙소인스타: @dubhe_soyang 가격: 220,000 ~__ __ __ __ __ __ __ __ __ __ __ __ 💡여행지보다 숙소를 먼저 고르는 에디터가 추천해주는#숙소하다_완주 #숙소하다_전라북도˳˳사진 출처: @_____by.min @keeeplight @djddoc @g_crystal_ #완주숙소 #완주카페 #소양고택한옥스테이 #전주숙소 #전주한옥숙소 #한옥숙소 #뷰맛집숙소 #숙소추천",2021-08-26,35,소양고택_한옥스테이,"['#완주', '#소양고택', '#한옥스테이', '#힐링숙소', '#숙소하다_완주', '#숙소하다_전라북도˳˳사진', '#완주숙소', '#완주카페', '#소양고택한옥스테이', '#전주숙소', '#전주한옥숙소', '#한옥숙소', '#뷰맛집숙소', '#숙소추천']",1629936000.0,https://scontent-ssn1-1.cdninstagram.com/v/t51.2885-15/e35/240441039_798132457488981_4418815118249719197_n.jpg?_nc_ht=scontent-ssn1-1.cdninstagram.com&_nc_cat=109&_nc_ohc=GtpGMUwwnx8AX8CDw3k&edm=AP_V10EBAAAA&ccb=7-4&oh=e13f0b3f5365d045f1d831ca729b3949&oe=6162C8BC&_nc_sid=4f375e
32,"#태안 #더클래식펜션 청포대 해수욕장과 가까이 위치한 태안 숙소, 더클래식펜션입니다. 태안더클래식펜션은 객실에서 탁 트인 서해 바다를 볼 수 있는 곳 입니다. 이곳에 머무신다면, 바다전망을 보며 스파를 즐길 수 있는 룸을 추천해드려요 :) 창문에 걸터 앉아, 일몰을 감상하며 인생샷까지 남겨보시길 바랍니다 ♡🪄이런 분들에게 추천해드려요✧#서해바다 를 보며 힐링하고 싶은 분✧#일몰맛집 숙소를 찾는 분__ __ __ __ __ __ __ __ __ __ __ __ 주소: 충남 태안군 남면 청포대길 57-60 태안더클래식스파펜션체크인: 15:00 / 체크아웃: 11:00숙소인스타: @theclassicpension 가격: 120,000~__ __ __ __ __ __ __ __ __ __ __ __ 💡여행지보다 숙소를 먼저 고르는 에디터가 추천해주는#숙소하다_태안 #숙소하다_충청남도˳˳사진 출처: @theclassicpension @wonleeji__ @didiyamm @hwanhee_fanini @su7_hee @j._.jiiii1 @deer_rogi #국내숙소 #숙소추천 #태안여행 #태안가볼만한곳 #태안가족펜션 #태안숙소 #태안펜션 #태안펜션추천 #오션뷰펜션 #스파펜션추천",2021-08-24,31,태안더클래식펜션,"['#태안', '#더클래식펜션', '#서해바다', '#일몰맛집', '#숙소하다_태안', '#숙소하다_충청남도˳˳사진', '#국내숙소', '#숙소추천', '#태안여행', '#태안가볼만한곳', '#태안가족펜션', '#태안숙소', '#태안펜션', '#태안펜션추천', '#오션뷰펜션', '#스파펜션추천']",1629763200.0,https://scontent-ssn1-1.cdninstagram.com/v/t51.2885-15/e35/240448286_2031946196962361_5418522798974922801_n.jpg?_nc_ht=scontent-ssn1-1.cdninstagram.com&_nc_cat=105&_nc_ohc=6gFO4NgTAfUAX-AU1IK&tn=Ont8o1D8KKnPYM0B&edm=AP_V10EBAAAA&ccb=7-4&oh=199e0e5a692643d5eb372b32e32c6aa2&oe=616219F9&_nc_sid=4f375e
33,"#강릉 #더브리앙뜨 KBS2 ""한 번 다녀왔습니다""의 웨딩촬영지로 이름을 알린 강릉 신축펜션, 더브리앙뜨입니다.더브리앙뜨는 기준 2인에서 최대 3인이 머물 수 있는 룸으로 이루어진 숙소입니다. 방 앞에는 넓은 잔디밭이 펼쳐져 있는 것이 특징입니다. 창가 쪽에 마련된 테이블에서 맛있는 걸 먹으며 잔디밭 뷰를 즐겨보세요.침대 위, 옆에 위치한 자그만 창에서도 숲뷰를 즐길 수 있습니다. 침대 위에 앉아 인생샷 남기는 것도 좋을 것 같아요. 전 객실 개별 발코니, 개별 바베큐장이 있어 더욱 프라이빗하게 즐길 수 있는 강릉 숙소입니다⸝⸝⸝♡🪄이런 분들에게 추천해드려요✧프라이빗한 #강릉펜션 을 찾고 계신 분✧#한번다녀왔습니다 촬영지에서 하루 머물고 싶은 분__ __ __ __ __ __ __ __ __ __ __ __ 주소: 강원 강릉시 사천면 중앙서로 92-43체크인: 15:00 / 체크아웃: 11:00가격: 150,000~__ __ __ __ __ __ __ __ __ __ __ __ 💡여행지보다 숙소를 먼저 고르는 에디터가 추천해주는#숙소하다_강릉 #숙소하다_강원도˳˳사진 출처: sea.elah @_iiiro @rom__vely #강릉여행 #강릉숙소 #강릉숙소추천 #강릉펜션추천 #커플펜션추천 #뷰맛집숙소 #강릉감성숙소 #감성숙소 #숙소추천 #강릉가볼만한곳",2021-08-23,19,강릉,"['#강릉', '#더브리앙뜨', '#강릉펜션', '#한번다녀왔습니다', '#숙소하다_강릉', '#숙소하다_강원도˳˳사진', '#강릉여행', '#강릉숙소', '#강릉숙소추천', '#강릉펜션추천', '#커플펜션추천', '#뷰맛집숙소', '#강릉감성숙소', '#감성숙소', '#숙소추천', '#강릉가볼만한곳']",1629676800.0,https://scontent-ssn1-1.cdninstagram.com/v/t51.2885-15/e35/240201026_1184363492058130_5440465155972788546_n.jpg?_nc_ht=scontent-ssn1-1.cdninstagram.com&_nc_cat=110&_nc_ohc=9dQ99_nghGIAX_2_Zi5&edm=AP_V10EBAAAA&ccb=7-4&oh=fc98ef8af22e2cde1430c256708d0cd4&oe=6162D682&_nc_sid=4f375e
34,"#부안 #스테이변산바람꽃 바다를 내려다보는 절벽 위에 위치한 부안 숙소, 스테이 변산바람꽃입니다. 스테이 변산바람꽃의 앞바다는 밀물과 썰물 그리고 시간, 계절에 따라 달라져 숙소 안의 큰 창을 통해 다채로운 뷰를 감상할 수 있다고 해요. 나무 욕조가 있는 룸에선 바다를 바라보며 목욕을 즐길 수도 있답니다. 은은하게 나는 편백나무의 향까지 맡으며 힐링해보세요. 어릴 적 애니메이션에서 본 것과도 같은 동화 속 감성의 숙소에서 파도 소리를 들으며, 달과 별을 바라보며 하루를 보내보세요. 아마 잊을 수 없는 추억을 남기게 되실거에요 *✧*✧*✧🪄이런 분들에게 추천해드려요✧#바다뷰펜션 을 찾는 분✧#유럽감성 의 숙소에서 머물고 싶은 분__ __ __ __ __ __ __ __ __ __ __ __ 주소: 전북 부안군 진서면 작당길 6-7체크인: 16:00 / 체크아웃: 11:00숙소인스타: @stay.windflower __ __ __ __ __ __ __ __ __ __ __ __ 💡여행지보다 숙소를 먼저 고르는 에디터가 추천해주는#숙소하다_부안 #숙소하다_전라북도˳˳사진 출처: @gg.0304 @se_bin1 @cham.ni @suwan_ly @zzzu_e @yenalog #국내숙소 #숙소추천 #부안여행 #부안숙소 #부안펜션 #부안펜션추천 #에어비앤비추천 #에어비앤비숙소 #오션뷰펜션 #뷰맛집숙소 #감성숙소",2021-08-22,67,스테이 변산바람꽃,"['#부안', '#스테이변산바람꽃', '#바다뷰펜션', '#유럽감성', '#숙소하다_부안', '#숙소하다_전라북도˳˳사진', '#국내숙소', '#숙소추천', '#부안여행', '#부안숙소', '#부안펜션', '#부안펜션추천', '#에어비앤비추천', '#에어비앤비숙소', '#오션뷰펜션', '#뷰맛집숙소', '#감성숙소']",1629590400.0,https://scontent-ssn1-1.cdninstagram.com/v/t51.2885-15/e35/240047188_832328017653045_4035335613213677107_n.jpg?_nc_ht=scontent-ssn1-1.cdninstagram.com&_nc_cat=109&_nc_ohc=00OKRQLXTsgAX8zAIur&edm=AP_V10EBAAAA&ccb=7-4&oh=0cf8e41032762b5190744199904d66a3&oe=61627204&_nc_sid=4f375e
