,content,date,like,place,tags,unix,imgUrl
61,"#남해 #적정온도 자연을 담은 남해 감성숙소, 적정온도입니다.적정온도는 소박하게 / 소소하게 / 느긋하게 / 유유히로 총 4개 룸으로 이루어져 있습니다. '소박하게'는 야외노천탕만 이용 가능하지만 나머지 룸은 야외노천탕뿐만 아니라 개별수영장 이용도 가능하다고 합니다. 노천탕은 온수, 냉수 모두 이용 가능하니 참고해주세요 ! 이곳의 공식 포토존은 바로 삼각형 모양의 수영장인데요. 오션뷰와 산을 배경으로 인생샷을 건질 수 있답니다. 일몰 맛집으로도 유명하니 저녁 노을이 지기 전에 방문하셔서 황홀한 일몰을 즐겨보시길 바래요 :) 오션뷰 감상하며 자연 속에서 쉬다가고 싶은 분들께 적극 추천해드립니다 (∗❛⌄❛∗)🪄이런 분들에게 추천해드려요✧#일몰맛집 숙소를 찾는 분✧#남해풀빌라 숙소를 찾는 분✧풀벌레 소리를 들으며 #야외노천탕 을 즐기고 싶은 분__ __ __ __ __ __ __ __ __ __ __ __ 주소: 경남 남해군 서면 남서대로 1803-18체크인: 15:00 / 체크아웃: 11:00숙소인스타: @bestondo1 __ __ __ __ __ __ __ __ __ __ __ __ 💡여행지보다 숙소를 먼저 고르는 에디터가 추천해주는#숙소하다_남해 #숙소하다_경상남도˳˳사진 출처: @aria.leeee @hhhyo3o @sohee_lim #여름여행지 #여름휴가추천 #남해여행 #남해숙소 #남해숙소추천 #남해풀빌라추천 #풀빌라숙소 #숙소추천 #감성숙소",2021-07-19,18,남해,"['#남해', '#적정온도', '#일몰맛집', '#남해풀빌라', '#야외노천탕', '#숙소하다_남해', '#숙소하다_경상남도˳˳사진', '#여름여행지', '#여름휴가추천', '#남해여행', '#남해숙소', '#남해숙소추천', '#남해풀빌라추천', '#풀빌라숙소', '#숙소추천', '#감성숙소']",1626652800.0,https://scontent-ssn1-1.cdninstagram.com/v/t51.2885-15/e35/p1080x1080/218994817_956878055093900_6397820340965076715_n.jpg?_nc_ht=scontent-ssn1-1.cdninstagram.com&_nc_cat=108&_nc_ohc=_GEPMpZ8aREAX8TZcKF&tn=Ont8o1D8KKnPYM0B&edm=AP_V10EBAAAA&ccb=7-4&oh=872b9f234385adae51b04ca33933bb31&oe=61620E42&_nc_sid=4f375e
62,"#공주 #소소아한옥 작고 아름다운 공주의 한옥 숙소, 소소아 한옥입니다. 소소아한옥은 5동의 독채 한옥 숙소로 이루어져 있어 프라이빗하게 즐길 수 있는 곳입니다. 깔끔한 한옥 숙소에서 머물며 한적하게 쉬다가고 싶은 분들께 추천해드려요 :) 이곳이 유명한 이유는 바로 조식 때문이죠 ! 전 날에 커피 or 우유 둘 중에 선택하고, 원하는 시간대를 말씀하면 다음날 비주얼, 맛 모두 끝장나는 조식이 제공된다고 합니다. 계절마다 제공되는 조식 메뉴는 달라진다고 하니 참고해주세요 ╰( ^o^)╮🪄이런 분들에게 추천해드려요✧#공주한옥스테이 를 찾는 분✧#조식맛집 숙소를 찾는 분__ __ __ __ __ __ __ __ __ __ __ __ 주소:충남 공주시 제민천1길 81-2체크인: 16:00 / 체크아웃: 11:00숙소인스타: @sosoa_hanok __ __ __ __ __ __ __ __ __ __ __ __ 💡여행지보다 숙소를 먼저 고르는 에디터가 추천해주는#숙소하다_공주 #숙소하다_충청남도˳˳사진 출처: @hanso.oll @mayrose_sseon @summeririri_ @_gguum2 @0_nnnniinii #충청남도여행 #공주여행 #공주숙소 #공주숙소추천 #한옥숙소 #한옥스테이 #숙소추천 #감성숙소",2021-07-18,27,충남 공주시,"['#공주', '#소소아한옥', '#공주한옥스테이', '#조식맛집', '#숙소하다_공주', '#숙소하다_충청남도˳˳사진', '#충청남도여행', '#공주여행', '#공주숙소', '#공주숙소추천', '#한옥숙소', '#한옥스테이', '#숙소추천', '#감성숙소']",1626566400.0,https://scontent-ssn1-1.cdninstagram.com/v/t51.2885-15/e35/219202692_559290688574816_3272802235417004946_n.jpg?_nc_ht=scontent-ssn1-1.cdninstagram.com&_nc_cat=108&_nc_ohc=PtyRtHHHrP0AX-46Qr5&edm=AP_V10EBAAAA&ccb=7-4&oh=053996a7a889b73f66b7e415779e6cb0&oe=6162D936&_nc_sid=4f375e
63,"#제주도 #꽃신민박 작은 숲 속에 있는 제주의 오두막집, 꽃신민박입니다. 꽃신민박은 아늑한 시골집 민박을 떠올리게 하는 숙소입니다. 최대 2인까지 머물 수 있는 오두막 개인실, 안채 큰방 그리고 최대 1인이 머물 수 있는 안채 작은방으로 총 3개의 객실로 이루어져 있습니다. 혼자 제주도 여행을 하시는 분이나 친구, 연인과 함께 머물기 좋은 2인숙소로 추천해드려요. 큰 나무로 둘러싸여 있어서 더욱 숲속에 있는 듯한 느낌을 주는데요. 평상에 앉아 새소리를 들으며, 시원한 바람을 느끼며 자연 속에서 힐링해보시길 바래요.호스트 분께서 토스트와 샐러드 등의 조식을 준비해주신다고 하니 맛있게 드시고 오시길 바랍니다 :) 🪄이런 분들에게 추천해드려요✧#자연친화적 인 곳에서 하루 머물고 싶은 분✧#오두막집 에서 #리틀포레스트 를 경험해보고 싶은 분✧#동남아분위기 가 물씬 나는 숙소를 찾는 분__ __ __ __ __ __ __ __ __ __ __ __ 주소: 제주 제주시 한경면 용금로 552-3체크인: 16:00 / 체크아웃: 11:00가격: 1박 기준 4~6만원__ __ __ __ __ __ __ __ __ __ __ __ 💡여행지보다 숙소를 먼저 고르는 에디터가 추천해주는#숙소하다_제주도˳˳사진 출처: @yerrrr__ @miajojojo @solv_vi0823 @yuuuuun__a #제주도여행 #제주도가볼만한곳 #제주도숙소 #제주도숙소추천 #제주감성숙소추천 #제주숙소 #제주숙소추천 #제주도에어비앤비 #에어비앤비제주 #숲속펜션 #한경면숙소 #제주도커플여행 #제주도커플숙소 #힐링숙소",2021-07-16,24,제주도,"['#제주도', '#꽃신민박', '#자연친화적', '#오두막집', '#리틀포레스트', '#동남아분위기', '#숙소하다_제주도˳˳사진', '#제주도여행', '#제주도가볼만한곳', '#제주도숙소', '#제주도숙소추천', '#제주감성숙소추천', '#제주숙소', '#제주숙소추천', '#제주도에어비앤비', '#에어비앤비제주', '#숲속펜션', '#한경면숙소', '#제주도커플여행', '#제주도커플숙소', '#힐링숙소']",1626393600.0,https://scontent-ssn1-1.cdninstagram.com/v/t51.2885-15/e35/p1080x1080/218725604_1211704715924275_4667715628153862135_n.jpg?_nc_ht=scontent-ssn1-1.cdninstagram.com&_nc_cat=107&_nc_ohc=mgBFUjkmc50AX-k_17L&edm=AP_V10EBAAAA&ccb=7-4&oh=59e61a422437a69a89f2983cfefeaac9&oe=61632CC8&_nc_sid=4f375e
64,"#서울 #보안스테이 문화, 역사의 중심지인 서촌에 자리한 숙소, 보안스테이입니다.보안스테이는 매력적인 전망을 지니고 있는데요. 북악산과 경복궁, 청와대, 서촌의 한옥 등 주변의 특색있는 풍경을 감상할 수 있다고 합니다. 4층 공용 주방에서도 멋진 한옥 뷰를 즐길 수 있다고 하니 커피를 내리며 맘껏 감상해보세요 :) 총 6개의 객실로 이루어져 있습니다. 31,32,33번방은 공용욕실을 함께 사용해야하지만 34,41,42번방은 개인 욕실이 있다고 하니 참고해주세요 ! 🪄이런 분들에게 추천해드려요✧도심 속에서 힐링하고 싶은 분✧서울의 사계절을 즐기고 싶은 분✧#서울여행 을 하며 머무를 숙소를 찾는 분__ __ __ __ __ __ __ __ __ __ __ __ 주소: 서울특별시 종로구 효자로 33 (통의동)체크인: 15:00 / 체크아웃: 11:00숙소문의: @boan1942 __ __ __ __ __ __ __ __ __ __ __ __ 💡여행지보다 숙소를 먼저 고르는 에디터가 추천해주는#숙소하다_서울˳˳사진 출처: @nang_rangeee @dh_nuu @__mk.st @kimhama94 #서울여행코스 #서촌데이트 #서울데이트 #서울데이트코스 #서촌숙소 #서울감성숙소 #서울에어비앤비 #에어비앤비추천 #힐링숙소 #숙소추천 #감성숙소 #서울가볼만한곳",2021-07-14,21,"Seoul, Korea","['#서울', '#보안스테이', '#서울여행', '#숙소하다_서울˳˳사진', '#서울여행코스', '#서촌데이트', '#서울데이트', '#서울데이트코스', '#서촌숙소', '#서울감성숙소', '#서울에어비앤비', '#에어비앤비추천', '#힐링숙소', '#숙소추천', '#감성숙소', '#서울가볼만한곳']",1626220800.0,https://scontent-ssn1-1.cdninstagram.com/v/t51.2885-15/e35/217194055_908433913348047_8901941949749278181_n.jpg?_nc_ht=scontent-ssn1-1.cdninstagram.com&_nc_cat=103&_nc_ohc=pvKk_ANDlVcAX_9SV0N&edm=AP_V10EBAAAA&ccb=7-4&oh=fca07d58f4b64835d66740add6cc25ea&oe=6163DF39&_nc_sid=4f375e
65,"#강릉 #너울민박 강릉의 신상 독채 숙소, 너울민박입니다.너울민박은 2인에서 최대 3인까지 이용할 수 있는 독채스테이입니다. 침대는 퀸 사이즈 1대로 구성되어 있지만, 1인 추가시 별도의 침구세트를 준비해주신다고 하니 3인이 머물러도 문제없답니다. 숙소에 들어서면 사장님께서 틀어놓으신 음악들로 기분좋게 숙소를 구경할 수 있는데요. 사장님 플레이리스트가 좋다는 후기가 많으니 감성 있게 음악을 들으며 숙소를 구경해보시길 바래요 :) 통창으로 이루어진 곳이 많아 초록뷰를 즐기며 하루를 보낼 수 있는 숙소입니다. 주방에는 핸드드립커피를 즐길 수 있도록 커피원두가 넉넉히 준비되어 있다고 합니다. 일행과 함께 오순도순 이야기하며 여유로운 커피타임을 가져보세요 ! 분위기 끝판왕인 자쿠지는 너울민박의 최고 힐링공간이죠. 입욕제로 사해소금이 제공된다고 하니 부드럽게 즐겨보시길 바래요. 큰 통창이 나있는 침실에서 인생샷까지 찍으면 완벽한 하루가 될거라 생각됩니다 ..♡✧🪄이런 분들에게 추천해드려요✧자쿠지가 있는 #강릉숙소 를 찾는 분✧#강릉감성숙소 를 찾는 분✧친구와 함께 가기 좋은 숙소를 찾는 분__ __ __ __ __ __ __ __ __ __ __ __ 주소: KTX 강릉역에서 도보 3분거리 (자세한 주소는 예약확정 후 안내) 체크인: 15:00 / 체크아웃: 11:00숙소문의: @neoulminbak __ __ __ __ __ __ __ __ __ __ __ __ 💡여행지보다 숙소를 먼저 고르는 에디터가 추천해주는#숙소하다_강릉 #숙소하다_강원도˳˳사진 출처: @jjjy_oh @_ja.0_ @sjh__dk2 @bottari92 #강릉여행 #강릉숙소추천 #강릉독채펜션 #강릉펜션추천 #강릉에어비앤비 #독채스테이 #감성숙소 #강릉스파펜션 #자쿠지펜션",2021-07-13,19,강릉,"['#강릉', '#너울민박', '#강릉숙소', '#강릉감성숙소', '#숙소하다_강릉', '#숙소하다_강원도˳˳사진', '#강릉여행', '#강릉숙소추천', '#강릉독채펜션', '#강릉펜션추천', '#강릉에어비앤비', '#독채스테이', '#감성숙소', '#강릉스파펜션', '#자쿠지펜션']",1626134400.0,https://scontent-ssn1-1.cdninstagram.com/v/t51.2885-15/e35/p1080x1080/214275211_1026417274561131_6715494040120942536_n.jpg?_nc_ht=scontent-ssn1-1.cdninstagram.com&_nc_cat=103&_nc_ohc=TLATZ-9QXYsAX-rgwLt&tn=Ont8o1D8KKnPYM0B&edm=AP_V10EBAAAA&ccb=7-4&oh=3bd48c0687b3a63db395988cb14f5172&oe=6162B04B&_nc_sid=4f375e
66,"#동해 #어쩌다어달 그림같은 오션뷰를 볼 수 있는 동해 숙소, 어쩌다어달입니다.어쩌다어달은 1,2,3호라인으로 호수마다 객실이 다르게 구성되어 있습니다. 1호라인은 원룸형으로 침대 1, 화장실 1개로 공동주방을 사용해야하며, 2호라인은 객실 내에 주방이 있다고 합니다. 만약 오션뷰와 함께 스파를 즐기고 싶다면 3호라인을 추천해드립니다 :) 일출맛집이라고 소문난 숙소이니 아침에 일찍 일어나 황홀한 동해바다의 일출을 꼭 ! 즐겨보시길 바래요 ( *ˊᵕˋ)🪄이런 분들에게 추천해드려요✧#동해오션뷰 를 하루종일 즐기고 싶은 분✧#커플펜션 을 찾고 계신 분✧#일출맛집 숙소를 찾고 계신 분__ __ __ __ __ __ __ __ __ __ __ __ 주소: 강원 동해시 일출로 309 체크인: 15:00 / 체크아웃: 11:00숙소문의: @eojjeoda_eodal __ __ __ __ __ __ __ __ __ __ __ __ 💡여행지보다 숙소를 먼저 고르는 에디터가 추천해주는#숙소하다_동해 #숙소하다_강원도˳˳사진 출처: @e.eunna @kimcri_ @ssonx_e @shbbbbebe__ @djswl._.7 @j_____w__131 @leeyoona__ #숙소추천 #강원도여행 #동해여행 #동해숙소 #강릉숙소 #강릉오션뷰펜션 #오션뷰숙소 #오션뷰펜션 #오션뷰스파 #일몰명소 #일출명소 #여름여행지",2021-07-12,25,동해,"['#동해', '#어쩌다어달', '#동해오션뷰', '#커플펜션', '#일출맛집', '#숙소하다_동해', '#숙소하다_강원도˳˳사진', '#숙소추천', '#강원도여행', '#동해여행', '#동해숙소', '#강릉숙소', '#강릉오션뷰펜션', '#오션뷰숙소', '#오션뷰펜션', '#오션뷰스파', '#일몰명소', '#일출명소', '#여름여행지']",1626048000.0,https://scontent-ssn1-1.cdninstagram.com/v/t51.2885-15/e35/214351763_2127589987380574_4206781277575885089_n.jpg?_nc_ht=scontent-ssn1-1.cdninstagram.com&_nc_cat=110&_nc_ohc=YrRh-ZM82vsAX_NU31i&tn=Ont8o1D8KKnPYM0B&edm=AP_V10EBAAAA&ccb=7-4&oh=5593285670e423bb697e199076f5a1cf&oe=6162E015&_nc_sid=4f375e
67,"#하동 #유로제다 녹차밭뷰를 감상할 수 있는 하동 숙소, 유로제다입니다.유로제다는 1층과 2층으로 나누어져 있는데요 ! 1층은 성인 3명에서 최대 5명까지 머무를 수 있고, 2층은 성인 2명에서 최대 3명까지 가능하다고 합니다. 두 객실 모두 데크가 있기 때문에 하동의 녹차밭뷰를 더 가까이 볼 수 있답니다 :) 창문에서 탁 트인 녹차밭뷰를 보고싶다면 1층보다는 2층을 추천해드립니다 ♡이곳의 또다른 장점은 녹차밭뿐만 아니라 쏟아지는 밤하늘의 별을 볼 수 있다는겁니다 ! 주위의 다른 불빛이 없어 정말 선명한 밤하늘의 별을 볼 수 있다고 하니 꼭 별구경 하시면서 낭만있게 하루를 마무리해보시길 바래요 :) 방 안에 마련된 예쁜 다기를 사용해서 유로제다에서 직접 생산한 고급 수제차를 즐겨보시길 바랍니다. 🪄이런 분들에게 추천해드려요✧#녹차밭 뷰를 보며 하루를 보내고 싶은 분✧#별구경 명소를 찾는 분✧고급 수제차를 즐기며 여유로운 시간을 보내고 싶은 분__ __ __ __ __ __ __ __ __ __ __ __ 주소: 경남 하동군 화개면 신촌도심길 43-7 체크인: 14:00 / 체크아웃: 11:00문의전화: 055-883-2911 __ __ __ __ __ __ __ __ __ __ __ __ 💡여행지보다 숙소를 먼저 고르는 에디터가 추천해주는#숙소하다_하동 #숙소하다_경상남도˳˳사진출처 : @byeon_su @yoni____i @hye_lim_zzang @_jour.nee #국내여행지추천 #하동여행 #하동여행코스 #하동가볼만한곳 #하동숙소 #하동숙소추천 #뷰맛집숙소 #초록뷰 #하동녹차밭 #경상남도여행 #숙소추천 #감성숙소 #힐링여행",2021-07-10,15,하동,"['#하동', '#유로제다', '#녹차밭', '#별구경', '#숙소하다_하동', '#숙소하다_경상남도˳˳사진출처', '#국내여행지추천', '#하동여행', '#하동여행코스', '#하동가볼만한곳', '#하동숙소', '#하동숙소추천', '#뷰맛집숙소', '#초록뷰', '#하동녹차밭', '#경상남도여행', '#숙소추천', '#감성숙소', '#힐링여행']",1625875200.0,https://scontent-ssn1-1.cdninstagram.com/v/t51.2885-15/e35/213602524_1899268533584814_6887330676495311543_n.jpg?_nc_ht=scontent-ssn1-1.cdninstagram.com&_nc_cat=106&_nc_ohc=qs2KJF6sZVIAX8tEkjD&edm=AP_V10EBAAAA&ccb=7-4&oh=0d4f8676baa44436016af82c7212e14c&oe=61623D61&_nc_sid=4f375e
68,"#충주 #서유숙펜션 넓은 정원이 있는 고즈넉한 충주 한옥 숙소, 서유숙펜션입니다.서유숙펜션은 천 여평에 이르는 넓은 정원이 있어 답답하지 않게 하루를 보내기에 최적화된 곳입니다. 아름다운 야생화들이 자라는 정원을 바라보며 힐링할 수 있는 숙소라고 할 수 있죠 :) 서유숙펜션을 전부터 알고계신 분들이라면 이곳이 조식 맛집이라는 건 이미 알고계실텐데요 ! 아침 9시에 관리실 앞에서 죽, 고구마, 해시브라운 등의 푸짐한 조식 한 상이 소쿠리 같은 곳에 제공된다고 합니다. (계절에 따라 메뉴 변동될 수 있음) 객실이나 야외에서 식사 가능하다고 하니 참고해주세요 ˘◡˘🪄이런 분들에게 추천해드려요✧#한옥펜션 을 찾고 계신 분✧고즈넉한 #충주숙소 를 찾고 계신 분✧#조식맛집 숙소를 찾고 계신 분__ __ __ __ __ __ __ __ __ __ __ __ 주소: 충북 충주시 소태면 덕은로 596 체크인: 15:00 / 체크아웃: 11:00숙소문의: @stay.seoyoosuk __ __ __ __ __ __ __ __ __ __ __ __ 💡여행지보다 숙소를 먼저 고르는 에디터가 추천해주는#숙소하다_충주 #숙소하다_충청북도˳˳사진 출처: @hyevely_day @yumyum_zzisu @ju_h_e_e @kong___min @mz.___.e #국내여행추천 #충주여행 #충주가볼만한곳 #충주맛집 #충주여행코스 #한옥펜션추천 #독채한옥 #한옥독채 #펜션추천 #한옥숙소 #감성숙소 #숙소추천",2021-07-08,18,충주시,"['#충주', '#서유숙펜션', '#한옥펜션', '#충주숙소', '#조식맛집', '#숙소하다_충주', '#숙소하다_충청북도˳˳사진', '#국내여행추천', '#충주여행', '#충주가볼만한곳', '#충주맛집', '#충주여행코스', '#한옥펜션추천', '#독채한옥', '#한옥독채', '#펜션추천', '#한옥숙소', '#감성숙소', '#숙소추천']",1625702400.0,https://scontent-ssn1-1.cdninstagram.com/v/t51.2885-15/e35/p1080x1080/212098133_329936802149319_1254068664773915714_n.jpg?_nc_ht=scontent-ssn1-1.cdninstagram.com&_nc_cat=103&_nc_ohc=ZfDxON5cA2cAX--Pmij&edm=AP_V10EBAAAA&ccb=7-4&oh=fd0f92753b3d973280528fabe111f203&oe=61634EF7&_nc_sid=4f375e
69,"#포항 #네이처풀빌라 네이처풀빌라는 모던한 인테리어와 바다가 한눈에 보이는 포항의 풀빌라입니다. 전 객실에서 바다뷰를 볼 수 있을뿐만 아니라 개별테라스에서 바베큐를 구워먹으며 히노끼족욕까지 즐길 수 있다고 합니다. 객실타입은 제트스파와 개별 야외수영장을 이용할 수 있는 풀빌라와 제트스파를 이용할 수 있는 스파빌라로 나누어져 있습니다. 여덟개의 룸 중에서 제일 인기가 많은 룸은 원형 침대가 있고 뷰가 좋은 201호와 301호라고 합니다.  201호는 제트스파를 즐길 수 있고, 301호는 제트스파와 야외 개인수영장 이용이 가능한 룸이니 참고해주세요 :) 푹식한 침대에 누워도 탁 트인 바다뷰를 볼 수 있는, 일몰과 일출이 아름다운 네이처풀빌라로 아름다운 포항여행을 보내보세요! 🪄이런 분들에게 추천해드려요✧전망 좋은 #풀빌라펜션 을 찾는 분✧제트스파 이용이 가능한 #포항풀빌라펜션 을 찾는 분✧멋진 일몰과 일출을 푹신한 침대에서 즐기고 싶은 분__ __ __ __ __ __ __ __ __ __ __ __ 주소: 경북 포항시 북구 청하면 해안로 2092체크인: 15:00 / 체크아웃: 11:00숙소문의: @nature_poolvilla_official __ __ __ __ __ __ __ __ __ __ __ __ 💡여행지보다 숙소를 먼저 고르는 에디터가 추천해주는#숙소하다_포항 #숙소하다_경상북도 ˳˳사진 출처: @_c.honey @iss_v @h.z00_ @euni_boogie @h__love._ #포항여행 #포항숙소 #포항숙소추천#포항풀빌라 #포항풀빌라추천 #포항오션뷰펜션 #포항수영장펜션 #풀빌라펜션 #풀빌라추천 #풀빌라숙소 #오션뷰펜션 #오션뷰숙소 #오션뷰풀빌라",2021-07-07,15,Pohang,"['#포항', '#네이처풀빌라', '#풀빌라펜션', '#포항풀빌라펜션', '#숙소하다_포항', '#숙소하다_경상북도', '#포항여행', '#포항숙소', '#포항숙소추천', '#포항풀빌라', '#포항풀빌라추천', '#포항오션뷰펜션', '#포항수영장펜션', '#풀빌라펜션', '#풀빌라추천', '#풀빌라숙소', '#오션뷰펜션', '#오션뷰숙소', '#오션뷰풀빌라']",1625616000.0,https://scontent-ssn1-1.cdninstagram.com/v/t51.2885-15/e35/212142115_186089926818664_2377549143453464541_n.jpg?_nc_ht=scontent-ssn1-1.cdninstagram.com&_nc_cat=104&_nc_ohc=9fYs4h_DDmsAX8VyTDe&tn=Ont8o1D8KKnPYM0B&edm=AP_V10EBAAAA&ccb=7-4&oh=626c11b8617e0bd65fac7ce88216a8d0&oe=616313ED&_nc_sid=4f375e
70,#제주도 #애월숙소 제주도 애월에 위치한 감성 가득한 숙소들을 모아봤습니다 💛앞으로 쭉~ 제주도 숙소를 지역별로 추천해드릴테니 많은 관심 부탁드려요 '◡'✿#드렌도트 #볼수록제주 #이티하우스 #솔트애월 #애월기록 💡여행지보다 숙소를 먼저 고르는 에디터가 추천해주는#숙소하다_제주도˳˳사진 출처: @heonlo.qb @hyangg2___ @yean_doo @sephzu @_d.ongeuny #국내여행 #제주도여행코스 #제주도숙소추천 #제주오션뷰숙소 #제주도감성숙소 #제주도독채펜션 #제주숙소추천 #제주뷰맛집 #제주도숙소 #제주도민박 #제주도펜션 #제주도게스트하우스 #감성숙소 #숙소추천 #애월숙소추천,2021-07-06,23,제주도,"['#제주도', '#애월숙소', '#드렌도트', '#볼수록제주', '#이티하우스', '#솔트애월', '#애월기록', '#숙소하다_제주도˳˳사진', '#국내여행', '#제주도여행코스', '#제주도숙소추천', '#제주오션뷰숙소', '#제주도감성숙소', '#제주도독채펜션', '#제주숙소추천', '#제주뷰맛집', '#제주도숙소', '#제주도민박', '#제주도펜션', '#제주도게스트하우스', '#감성숙소', '#숙소추천', '#애월숙소추천']",1625529600.0,https://scontent-ssn1-1.cdninstagram.com/v/t51.2885-15/e35/210419353_328336798898256_5303126525582725784_n.jpg?_nc_ht=scontent-ssn1-1.cdninstagram.com&_nc_cat=100&_nc_ohc=-uQ3MKQ1ZAsAX9XRbFV&edm=AP_V10EBAAAA&ccb=7-4&oh=355b11ce8bc3a8c7d03d0a8b820bcb45&oe=6163258A&_nc_sid=4f375e
71,"#담양 #까망감스테이 추월산에 둘러싸여 있는 담양의 감성숙소, 까망감스테이입니다.담양 속 리틀 포레스트라고 불리는 까망감스테이는 추월산과 담양호를 끼고 있는 숙소입니다. 전 객실 마운틴뷰를 즐길 수 있어 자연 속에서 진정한 휴식을 취하고 싶은 분들께 추천해드립니다,,✿또한, 전 객실이 숲과 정원을 정면으로 보는 설계이기 때문에 객실 내에서도 자연을 충분히 느끼실 수 있고, 인생샷 또한 건질 수 있답니다:) 샐러드, 식빵, 과일 등의 조식이 냉장고에 미리 준비되어 있다고 합니다. 아침에 일어나 마운틴뷰를 즐기며 조식을 만들어 드셔보세요 ! 🪄이런 분들에게 추천해드려요✧#리틀포레스트 를 즐기고 싶은 분✧#마운틴뷰 를 볼 수 있는 숙소를 찾는 분✧감성 가득한 #담양숙소 를 찾는 분__ __ __ __ __ __ __ __ __ __ __ __ 주소: 전남 담양군 용면 추월산로 900-11 스테이1 체크인: 15:00 / 체크아웃: 11:00스테이2 체크인: 18:00 / 체크아웃: 15:00숙소문의: @camanggam_stay __ __ __ __ __ __ __ __ __ __ __ __ 💡여행지보다 숙소를 먼저 고르는 에디터가 추천해주는#숙소하다_담양 #숙소하다_전라남도˳˳사진 출처: @seulee__90 @kkkimm_725 @seonha_han @wooriri__ @yu._.gon #국내여행추천 #담양여행 #담양가볼만한곳 #담양숙소추천 #담양카페추천 #마운틴뷰숙소 #숲뷰 #뷰맛집숙소 #숙소추천 #감성숙소",2021-07-05,19,전남 담양,"['#담양', '#까망감스테이', '#리틀포레스트', '#마운틴뷰', '#담양숙소', '#숙소하다_담양', '#숙소하다_전라남도˳˳사진', '#국내여행추천', '#담양여행', '#담양가볼만한곳', '#담양숙소추천', '#담양카페추천', '#마운틴뷰숙소', '#숲뷰', '#뷰맛집숙소', '#숙소추천', '#감성숙소']",1625443200.0,https://scontent-ssn1-1.cdninstagram.com/v/t51.2885-15/e35/211307440_234048375226030_3986573337030076887_n.jpg?_nc_ht=scontent-ssn1-1.cdninstagram.com&_nc_cat=110&_nc_ohc=jdkvBYAomS4AX-RTGDL&tn=Ont8o1D8KKnPYM0B&edm=AP_V10EBAAAA&ccb=7-4&oh=33840c631bece85befab76e9f058eb26&oe=61629760&_nc_sid=4f375e
